1264, 127, Repudiandae labore voluptatem quas magni praesentium minima. Occaecati dolorem occaecati sint numquam. Delectus in odio nesciunt.
1265, 127, Rem aut voluptas aut placeat. Ad numquam impedit illo quaerat consequatur deserunt a. Impedit odio inventore sint repellendus.
1266, 127, Tenetur dolores necessitatibus nihil ut id. Inventore deserunt repudiandae ut atque neque distinctio exercitationem. Provident et odio eaque aperiam.
1267, 127, Est illum magni ratione suscipit nihil explicabo. Repudiandae autem minus sunt delectus et mollitia. Velit et architecto nisi quidem sit tempora.
1268, 127, Totam nihil ut asperiores porro at vel aut. Quos rem fugiat tenetur. Rerum dolor quos aut ab.
1269, 127, Dolores explicabo tempore nobis unde est quia. Eos aut sint accusantium unde est aut eos quia. Cum odit odit omnis recusandae modi amet hic.
1270, 127, Sunt illo ipsa fugiat eum molestias. Sequi optio ipsum omnis et eum mollitia sit cupiditate. Ea enim aut qui.
1271, 128, Aliquam et quaerat eum quo. Quasi consequuntur ea labore fugiat voluptatem provident sapiente placeat. Fuga aliquam iste fuga eveniet eum alias sed.
1272, 128, Aut illum ut explicabo et porro eum aut. Tempore temporibus totam voluptate amet esse nisi magni. Optio doloribus quisquam aut necessitatibus at ut enim.
1273, 128, Quidem odit temporibus nulla deleniti sapiente. Deleniti rem illo et natus sit. Voluptas autem dolore impedit delectus.
1274, 128, Officiis facilis ipsum consequatur alias velit perferendis. Dolorum dolorum hic qui recusandae ut voluptates. Molestias earum eaque dicta expedita expedita cum et facilis.
1275, 128, Animi non qui maiores est. Et reprehenderit at voluptatem repudiandae non. Rerum perspiciatis eos omnis voluptates ipsa occaecati iure et.
1276, 128, Et quo voluptatem aliquid dolor maxime modi minus. Eum provident consequatur temporibus. Cum perferendis nobis voluptatem nam sit.
1277, 128, Asperiores dolorem earum enim magni excepturi. Beatae maxime eligendi cumque itaque delectus dicta et. Sapiente veniam et quo omnis.
1278, 128, Quia non molestias omnis magni repudiandae odio vel natus. Adipisci voluptatem et voluptates. Sint ut ad voluptatibus est debitis nam non.
1279, 128, Ratione exercitationem et nemo ea. Blanditiis labore ab quibusdam voluptatem aut odit eos. Ipsam ut quis maxime perspiciatis est.
1280, 128, Dolores asperiores vel quis ut. Cum corrupti id nemo quae sit officiis culpa repellat. Aspernatur reiciendis iusto dicta id numquam quaerat commodi.
1281, 129, Modi dolor ab tempore perspiciatis deleniti possimus sit reiciendis. Veniam et magni eos modi voluptatum. Id enim corrupti tempora esse dignissimos aut dolorem.
1282, 129, Quae blanditiis impedit iusto. Perferendis et quibusdam officia alias quia. Et consectetur ut at quam provident id aut at.
1283, 129, Soluta iure ipsum eius dicta. Molestiae laudantium sit nostrum et. Consequatur quia in eaque sed.
1284, 129, Incidunt aut voluptas et expedita error quis doloribus mollitia. Mollitia consequatur est consequatur nesciunt quasi aliquam alias. Dolor amet maxime eos quis debitis modi laboriosam.
1285, 129, Harum ea aut voluptatem commodi atque vero. Adipisci dolorum sit officiis voluptatibus. Cumque iste unde saepe recusandae voluptates voluptas maiores autem.
1286, 129, Dolorem laboriosam et eum pariatur ab voluptas. Nisi voluptate quibusdam numquam quae. Et ad sit et.
1287, 129, Repellat pariatur eum exercitationem occaecati et maiores eos minus. Nam quidem dolorem pariatur. Temporibus praesentium consectetur et consectetur neque.
1288, 129, Unde id non odio consectetur iure quibusdam vitae ratione. Dolores rerum labore libero qui dicta iusto. Quasi ut cupiditate aliquam necessitatibus culpa omnis neque molestiae.
1289, 129, Modi reprehenderit quae excepturi saepe. Et qui ratione accusantium non quos. Aliquam quia fugiat eos magni fugit.
1290, 129, Maxime fugiat maxime corrupti. Veritatis pariatur pariatur adipisci ut aut minus adipisci. Et quasi nobis sed adipisci illo omnis.
1291, 130, Non laboriosam est libero nam vero. Occaecati repudiandae accusamus suscipit dicta quasi. Doloremque provident sint consequatur rerum rerum libero.
1292, 130, Ratione corporis consequatur est fugiat et sit tempore. Est eligendi porro ratione et consequuntur natus. Ut voluptatibus nihil accusantium quis eveniet quisquam.
1293, 130, Voluptate aut delectus vero commodi ex deleniti. Nulla beatae inventore inventore et. Unde aspernatur amet quas repudiandae ea ipsam voluptas.
1294, 130, Omnis optio ut repellat esse ut excepturi suscipit. Ratione at illo et ut dolorem pariatur qui deserunt. Qui impedit qui aperiam sapiente quia.
1295, 130, Et tempore optio dolor dolorum. Animi qui eaque vel consequuntur cupiditate et. Ipsa sed ea id expedita sint.
1296, 130, Accusantium id voluptatem expedita placeat voluptas corrupti autem. Autem debitis nostrum corrupti alias. Illo corrupti iusto ut officia.
1297, 130, Maiores libero laboriosam est ipsum. Qui sequi non similique dicta. Adipisci aliquam modi est.
1298, 130, Ut quas facilis minus eligendi. Ab repudiandae ipsum eveniet. Et quia deserunt animi.
1299, 130, Illum ex qui explicabo aspernatur. At ducimus enim perferendis quibusdam ad qui vitae eos. Ipsam incidunt voluptatibus et eligendi qui facilis dolorem dignissimos.
1300, 130, Voluptas qui et incidunt. Perspiciatis illum in deleniti sequi in totam ipsam. Et animi expedita quia dolores ut itaque omnis.
1301, 131, Et esse voluptatem nihil optio corrupti unde velit. Totam culpa reiciendis neque. Dicta et velit non voluptatem quis.
1302, 131, Amet porro itaque dolore eos est et perspiciatis tenetur. Ad sint quisquam sit modi. Odit beatae est aut distinctio quia doloremque non excepturi.
1303, 131, Unde quae distinctio non in porro delectus illo ab. Et exercitationem ad delectus. Sit neque sapiente aliquam voluptas.
1304, 131, Dolores et incidunt quia laboriosam laudantium et labore et. Ut culpa qui mollitia cumque sunt officia. Voluptatem voluptatum neque consequatur sint assumenda consequatur eaque.
1305, 131, Libero provident maxime doloribus. Omnis iste aut tempora nulla. Fugit iure velit impedit id quos.
1306, 131, Omnis quam praesentium impedit quaerat rerum minus qui. Quia sit nesciunt magni est iusto ex sed aut. Omnis qui iusto earum qui qui a.
1307, 131, Ut atque dicta incidunt quod. Hic natus alias aliquid eum quaerat mollitia. Sit quia possimus autem tempore minus voluptate ut.
1308, 131, Odit facere dolorum velit deleniti aperiam autem. Quae harum et impedit sunt. Sit autem qui voluptatem mollitia dolore.
1309, 131, Nesciunt vel et in adipisci. Sit repellat vero quibusdam commodi qui quia officia saepe. Iste at nobis deserunt at sed.
1310, 131, Cupiditate ut laboriosam ut excepturi adipisci pariatur magnam. Qui quis cumque dolorem. Quidem quisquam ut quis accusantium.
1311, 132, Quia rerum rerum fugiat vel consequatur est. Repellendus enim nostrum in sit consequatur occaecati voluptatem. Corrupti officiis laudantium adipisci nam ullam nihil earum.
1312, 132, Ut quidem ab explicabo a non quia qui et. Quis neque officia et. Similique ullam sint commodi molestias est eos nemo.
1313, 132, Suscipit sint deleniti necessitatibus nemo dignissimos libero rerum culpa. At sit voluptatibus quod ut saepe voluptate et a. Rerum sed soluta aut dolorem debitis dignissimos commodi commodi.
1314, 132, Nam fuga repellendus aspernatur. Et officiis aspernatur inventore cum. Corporis qui eveniet temporibus itaque non delectus et.
1315, 132, Esse maiores qui natus explicabo. Architecto est quis tempora in cupiditate tenetur. Voluptatibus molestias illum recusandae minus error.
1316, 132, Unde est exercitationem saepe maxime. Soluta eaque aut in. Voluptas repellendus unde dolor.
1317, 132, Sint sint qui sed perferendis non. Rerum sit vel dolorum magni dignissimos. A doloribus molestias fuga.
1318, 132, Cum quis illum velit ea autem. Sunt exercitationem rem qui pariatur possimus fugiat. Vero dolores aliquid repellendus qui possimus labore rerum.
1319, 132, Aperiam voluptas in reprehenderit ut qui optio est. Possimus aspernatur magnam harum quae asperiores cupiditate sed laudantium. Nisi expedita beatae voluptatum numquam facere qui.
1320, 132, Fugiat laboriosam provident magnam rerum. Debitis beatae architecto voluptatum veritatis. Vitae atque suscipit dignissimos est quia laboriosam totam.
1321, 133, Accusantium nobis laudantium iusto quod a. Fugit necessitatibus dolorum et. Quibusdam maiores tempora esse consequatur aut aperiam omnis culpa.
1322, 133, Nihil odit inventore et commodi sunt sed. Blanditiis similique rerum corporis qui. Illum numquam libero in.
1323, 133, Quod voluptas velit ut voluptates nemo quasi neque rerum. Soluta et voluptatibus dolorum corporis. Placeat esse ratione ullam nihil consequatur dolor.
1324, 133, Doloremque reprehenderit error accusantium aut. Aut est minima ipsum iste magni vero ab et. Tenetur sint dolorem harum sunt.
1325, 133, Pariatur laudantium repellendus repellat nostrum ad. Expedita reiciendis et corporis eius. Consequatur quibusdam quos qui pariatur vel.
1326, 133, Sed optio minima pariatur. Nobis doloribus qui quo nesciunt. Consectetur dicta voluptatem doloribus voluptas in nam sit dolorum.
1327, 133, Saepe temporibus omnis molestiae sequi sint dolore voluptas omnis. Ea dolorum distinctio qui et sint autem impedit ea. Et nostrum quam ducimus sint commodi.
1328, 133, Quaerat eos eum itaque consequatur. Rerum et aut aut quo sit occaecati aut magni. Libero deserunt deleniti et consequatur quibusdam ut.
1329, 133, Non cumque vitae consequatur. Nihil fuga dolores atque corrupti consectetur. Voluptatem accusamus minus eveniet cupiditate.
1330, 133, Ullam quibusdam deleniti et. Repellat ratione incidunt id distinctio dolores. Est officiis odit et quia id illo sit sed.
1331, 134, Omnis ut magni nesciunt adipisci quo et eos doloremque. Alias assumenda eos aut non molestiae. Dolorem omnis recusandae sed repudiandae deleniti.
1332, 134, Explicabo expedita iure quisquam et est non. Voluptatem omnis libero enim tempora. Distinctio adipisci iste nemo natus qui.
1333, 134, Molestiae facere cum non suscipit placeat ullam. Consequatur exercitationem illo amet. Vitae atque eum tempore est dolorem maxime velit.
1334, 134, Eum fuga aperiam et. Id itaque alias eos. Ea minus similique id earum ea voluptatum sit fugiat.
1335, 134, Rerum nostrum sunt nulla totam at maxime tenetur qui. Odio eveniet nostrum sint culpa exercitationem et aliquid. Et voluptatem incidunt alias sint beatae voluptatem quidem quidem.
1336, 134, Et voluptatibus omnis rerum. Facere qui eos deleniti debitis veritatis optio ducimus. Eum fugit reprehenderit unde quo.
1337, 134, Autem similique ipsam corrupti perferendis architecto cumque qui. Unde nulla ipsam dolores maxime dolorem soluta. Deleniti et minus quam neque.
1338, 134, Qui numquam eum dolores repudiandae facere ut rerum ducimus. Vero molestiae atque sed cum occaecati rerum animi et. Ex eaque voluptatem repellat molestias laboriosam ducimus fugiat ducimus.
1339, 134, Minima nihil consectetur possimus debitis voluptates aliquid voluptatem. Qui et cum expedita vero. Dolor doloremque saepe beatae quia numquam.
1340, 134, Et id quam ut ut illo excepturi. Perferendis ut non non omnis et. Blanditiis et aut sed voluptatem cupiditate sequi.
1341, 135, Provident qui quas et voluptates. Praesentium eos neque odio omnis perspiciatis fugiat eaque harum. Dolorem quidem est vel eos blanditiis illum suscipit id.
1342, 135, Rem molestiae voluptatibus dolor maiores eligendi occaecati. Dicta voluptatem quo sed consectetur quis quos explicabo et. Velit eaque excepturi nostrum distinctio esse aut eligendi.
1343, 135, Culpa voluptate adipisci harum consequatur officia non. Cum fuga alias maiores soluta velit mollitia cum ut. Quae est ipsam et optio.
1344, 135, Perspiciatis odio est tenetur ullam alias. Numquam illum ipsum provident similique vitae. Et deleniti consequuntur consequatur debitis aut voluptas laudantium.
1345, 135, Corporis fugit repudiandae sit consequatur. At ab a molestias consequuntur totam reiciendis. Ab rerum distinctio est enim fugit.
1346, 135, Nihil enim quo sunt quas omnis dicta. Aut sed quis culpa consectetur amet sit voluptates dicta. Minima est et expedita itaque et.
1347, 135, Eos exercitationem accusamus non odio a corrupti. Optio a aut sunt sit debitis. Porro ullam nulla autem quam dolorem tempore libero ratione.
1348, 135, Eius ut sit voluptates consequatur omnis tempore pariatur. Sed distinctio voluptas sed quod. Ipsum aspernatur saepe incidunt consequatur numquam.
1349, 135, Enim est voluptas necessitatibus quis est qui tempora. Maiores dolores et sunt. Repudiandae suscipit unde sequi libero dicta dolor illo.
1350, 135, Corporis quos maxime quia ut. Eaque ut sed dolore rerum tempore aut quia est. Aut voluptatibus velit quas non et consequuntur inventore quibusdam.
1351, 136, Aspernatur sequi quia blanditiis ratione. Nostrum eligendi ipsum blanditiis facilis id optio consequatur. Odit rerum rerum deleniti voluptatem ea aliquid architecto.
1352, 136, Ut iusto dolores aliquid fugiat repudiandae at. Sunt molestiae qui modi. Vitae labore numquam recusandae accusamus voluptatum nesciunt.
1353, 136, Explicabo odio aspernatur incidunt impedit necessitatibus perferendis quis. Ea enim quo eveniet ducimus nobis. Aut veritatis minima facere accusamus excepturi accusamus aperiam error.
1354, 136, Nulla qui sunt modi doloremque modi. Repellat repellendus accusamus error eos. Occaecati rerum animi facere et sunt ut magnam sit.
1355, 136, Odit quia consequatur eligendi. Temporibus deleniti omnis culpa. Voluptas et molestias sit deserunt quae voluptates illum dolorem.
1356, 136, Aspernatur voluptas et ut. Ea quisquam porro quia aut totam architecto. Aut mollitia facere cupiditate id autem itaque inventore.
1357, 136, Vel deserunt corrupti laudantium. Consequatur beatae delectus placeat. Est libero ea placeat quia sequi velit et.
1358, 136, Est accusantium repellat delectus sint. Explicabo eum ullam illum eligendi vel facilis ut. Voluptatum alias inventore quam aut ullam tempora nam.
1359, 136, Consequatur nam rerum consectetur saepe animi est. Amet dolores in aut amet saepe. Officia totam corrupti omnis earum voluptas sint corrupti ut.
1360, 136, Est necessitatibus in blanditiis eos sed. Non voluptatem in asperiores. Enim similique pariatur libero dicta fuga ad ea sunt.
1361, 137, Cupiditate totam veniam est id eos minima deleniti. Ipsam et consequatur tenetur debitis natus. Debitis nostrum illum ut et pariatur sunt repellat.
1362, 137, Qui dolorem impedit ad molestiae voluptas voluptate est. Officiis ab suscipit et laudantium ducimus quo consectetur. Possimus aut dolores neque.
1363, 137, Repellat qui sint distinctio eius alias consequuntur. Ut adipisci molestiae tempore ea et reprehenderit. Rerum expedita accusamus quis ducimus tempora.
1364, 137, Quia voluptate sunt autem deserunt repellat. Ab temporibus ducimus vel ut molestiae. Ipsam impedit molestiae voluptatem modi sunt.
1365, 137, Ratione magnam sint eum asperiores aliquam est similique sapiente. Temporibus quas adipisci enim iste ipsa eos. Saepe quo aliquam eos unde quo.
1366, 137, Deleniti nisi enim sunt. Voluptates qui nobis architecto cumque ab sit. Quo iste reiciendis quas sunt dolore.
1367, 137, Praesentium placeat quia assumenda quia. Esse illo voluptatem esse sapiente. Quam ut exercitationem ut.
1368, 137, Saepe consequuntur ab quae cumque possimus itaque iste aut. Totam sit quas nostrum sint ut est. Quo quam dolor quas expedita fugit aspernatur sit dolorem.
1369, 137, Id ipsum quasi perspiciatis minima dolorem recusandae beatae. Aliquid neque autem id minima minima. Id voluptatem omnis vitae incidunt non officiis.
1370, 137, In fuga repellendus et fugiat et at. Eos iusto voluptas neque. Nostrum voluptate quia consequatur tempora maiores animi sit eius.
1371, 138, Deserunt reprehenderit labore in. Ea cupiditate eos est deleniti est similique voluptatum. Sed repudiandae aut esse voluptatem repellendus aut id.
1372, 138, Placeat voluptatibus minus aut possimus. Quibusdam consequatur maxime quas nihil quis laudantium optio beatae. Suscipit minus at sed voluptas deserunt quis quidem temporibus.
1373, 138, Aut vel blanditiis reiciendis laboriosam sed eligendi nihil assumenda. Eligendi expedita est nesciunt est animi laboriosam repudiandae. Est vel nihil architecto debitis et earum ipsa vero.
1374, 138, Sit quisquam sunt dolor perspiciatis commodi voluptatem quis. Nemo eius amet vel molestias quae. Eum temporibus est eveniet.
1375, 138, Qui excepturi autem qui. Sed perferendis maiores rerum. Nihil nemo voluptatem aliquam a maiores quia.
1376, 138, Quae sequi laudantium magnam et sapiente. Laboriosam voluptates non voluptatem. Aut ut aspernatur nostrum soluta illo.
1377, 138, A qui voluptatum quis et vel nesciunt deleniti doloribus. Voluptate illo necessitatibus aperiam voluptatem sint fugiat id praesentium. Maxime maiores molestiae et pariatur quasi a.
1378, 138, Unde officia molestiae dolores ut et soluta assumenda ut. Animi non maiores qui asperiores sequi. Magnam a consequatur itaque quisquam molestias.
1379, 138, Temporibus repudiandae blanditiis magnam ex maxime aperiam illo. Et dolor nisi rerum quibusdam inventore. Voluptatem nihil est velit qui in dolorum laboriosam ut.
1380, 138, Omnis tempore et animi laborum. Doloribus vel est velit saepe delectus voluptatem. In reiciendis mollitia dolores dolorem voluptas sed.
1381, 139, Illum minus quam voluptatum vitae enim corporis et. Vitae cumque ad quia aut laudantium dolores consequatur explicabo. Quibusdam esse voluptate natus reprehenderit dolores est et sit.
1382, 139, Voluptatum molestiae eum et et laboriosam doloremque. Et accusamus expedita et. Et voluptas tenetur aliquam quis.
1383, 139, Nam vitae autem esse perferendis laborum inventore illum aut. Est pariatur impedit consequatur et consequatur tempore laborum consectetur. Corrupti minus ut voluptate ipsa mollitia harum.
1384, 139, Enim est perspiciatis culpa qui. Labore voluptatum ex sit expedita nemo. Eligendi facere et consectetur omnis in a.
1385, 139, In dignissimos quis molestiae vitae est voluptates sed placeat. Veniam qui voluptatem qui et et autem iste. Harum praesentium ad rerum.
1386, 139, Sed numquam porro et quia voluptas. Et perspiciatis sapiente qui. Inventore et in tempore.
1387, 139, Modi eum nihil qui sapiente qui odit et. Ratione qui id veniam magni quia dolorem. Odio quis magni amet aspernatur natus explicabo labore.
1388, 139, Tempore et libero aut ab et. Et dolorem veniam et numquam at nihil rerum vitae. Est veniam esse consectetur dolorem corrupti quam aliquid.
1389, 139, Unde delectus eos nesciunt. Reprehenderit a debitis est reprehenderit architecto. Impedit quia voluptas qui.
1390, 139, Dolor in voluptatibus quisquam et. Qui repudiandae in quas ullam sint nobis. Officiis eos expedita natus quo harum nam hic.
1391, 140, Rem laudantium laboriosam quaerat fugit. Recusandae occaecati architecto eos eligendi enim et amet. Fuga exercitationem deleniti magni praesentium quis ut.
1392, 140, Fugiat tempora cupiditate consectetur dolores. Ullam voluptas nihil pariatur labore voluptates consectetur. Dolores optio enim voluptas.
1393, 140, Sed ut debitis dolor repellendus. Illo quia delectus id magni. Sit ut perferendis rerum.
1394, 140, Optio quibusdam nesciunt accusamus aliquam sapiente qui vero. Dolor earum provident a distinctio autem totam beatae cumque. Ut facilis minus neque quod sit.
1395, 140, Aut perspiciatis eum cumque ut quia nam quibusdam occaecati. Ut in nisi optio quae earum. Optio consequatur voluptas repudiandae velit molestiae qui minima amet.
1396, 140, Eum illum et et quia aut quas. Dolores ab sequi consequatur. Et nihil explicabo ut porro.
1397, 140, Accusamus dolorum non quia nostrum sint cupiditate. Ab aut id dolor nihil. Quis dolorem facilis ab possimus.
1398, 140, Consequuntur delectus sit odit ad excepturi animi. Illo omnis voluptatem et reiciendis. Occaecati delectus non quas illum commodi sit.
1399, 140, Blanditiis officia exercitationem nostrum totam aut pariatur. Tempore aut harum tenetur omnis facere rerum molestiae. Dolor neque et aut.
1400, 140, Voluptas ipsam ea fugiat velit. Aperiam excepturi consequuntur tempora cum quia officia autem. Dignissimos consequatur temporibus voluptates a sint molestiae beatae nostrum.
1401, 141, Eius inventore quos velit ut ab est nemo. Itaque ut iste nemo. Molestiae quae aut quo corrupti sunt.
1402, 141, Excepturi in laudantium eveniet ut ipsum vero at. Quae adipisci adipisci ut libero voluptatem non culpa. Esse at repellendus non unde rem explicabo nihil repudiandae.
1403, 141, Rerum velit doloribus hic ut quo quia id. Quaerat tempora sint nulla et. Non porro voluptas molestias voluptatum.
1404, 141, Et sed ab officia repudiandae tempora eaque necessitatibus enim. Repudiandae sit saepe quia eum officiis accusantium facere. Aspernatur nostrum rerum quia.
1405, 141, Quam veniam voluptatum voluptatem minus et nihil. Autem non magni necessitatibus voluptas quis. Atque impedit molestiae quis voluptatem est similique.
1406, 141, Illum sunt dolorum qui minus culpa labore ad cupiditate. Consequuntur ut eos qui. Modi expedita voluptate quia placeat culpa.
1407, 141, Totam ut nihil sunt excepturi enim. Qui ut rerum in iste. Amet beatae eos qui quod.
1408, 141, Eius placeat accusamus eaque temporibus qui eveniet autem. Asperiores atque praesentium distinctio commodi porro dolorem provident. Fugit distinctio incidunt ea.
1409, 141, Consequatur doloremque velit odio ea laudantium recusandae expedita. Vero soluta et dolorem et voluptates occaecati velit praesentium. Saepe laudantium quis consectetur error tenetur.
1410, 141, Atque ut perspiciatis deserunt aut doloremque doloribus ea blanditiis. Fugit omnis modi optio deserunt architecto et sint. Veritatis enim nihil consectetur vel ab quas qui nostrum.
1411, 142, Blanditiis ex nihil et rerum et et in impedit. Est dignissimos laboriosam facere ut qui ipsa. Non quaerat dolore magnam.
1412, 142, Adipisci vel sunt optio ipsa sit. Voluptatem officia aspernatur ipsa occaecati. Quae excepturi nisi nam repellendus iste sit et possimus.
1413, 142, Unde tempore cum unde accusamus in qui deserunt voluptas. Earum et iste ad minus consequatur. Cum velit earum et nobis rerum eos odit.
1414, 142, Ipsum ut vitae quo consectetur voluptas. Assumenda harum saepe est velit ut minima aut. Sed exercitationem non consequatur natus.
1415, 142, Ut neque fugit suscipit qui velit officia facere dolor. Placeat eveniet cum inventore consequatur ullam tenetur saepe sequi. Ea animi omnis cumque voluptatem laudantium aut.
1416, 142, Dolorem eius reiciendis et et. Ab qui voluptatem et aut nesciunt. Blanditiis aut perspiciatis ipsa autem.
1417, 142, Aut placeat eum magni dolor accusamus in natus et. Saepe odio quis est dignissimos veritatis corrupti. Explicabo debitis in et quibusdam culpa sunt et dolorem.
1418, 142, Qui enim perferendis quo dolor. Ut aut cumque aut. Cupiditate sit architecto velit sint voluptatem aliquid perferendis mollitia.
1419, 142, Fugiat molestias in aut voluptatem et vero. Maxime aliquam provident et. Deserunt similique quaerat est id ipsa voluptatem neque ut.
1420, 142, Ullam doloremque ratione quae ullam debitis. Repudiandae rerum qui nostrum ipsam. Beatae incidunt occaecati saepe enim impedit.
1421, 143, Adipisci rem alias facilis. Odio est ut ut. Est rerum distinctio et incidunt asperiores et sint.
1422, 143, Et nulla sit nostrum. Et velit ut rerum. Cum non rem aut est qui quam.
1423, 143, Esse et voluptas consequatur quaerat doloribus quidem animi. Voluptatem quia nihil deserunt necessitatibus iusto blanditiis. Quis voluptatem quas expedita nesciunt.
1424, 143, Ut voluptas dignissimos omnis. Et quos quod sunt atque. Architecto dolores minima natus dignissimos.
1425, 143, Aliquid voluptates qui exercitationem qui aliquam magnam. Sint unde et perferendis ut sapiente. Dolorem quisquam totam dignissimos molestias labore.
1426, 143, Nam minus facere unde sunt ut autem libero qui. Praesentium natus commodi ut nihil. Nihil sed iste tempora magnam laudantium iure et.
1427, 143, Et magnam provident nihil nihil quaerat mollitia ducimus adipisci. Non minus minima omnis maxime. Repellendus eum fugit nesciunt sit autem.
1428, 143, Laboriosam in animi necessitatibus incidunt rerum veritatis dolor. Sit ut amet officia et sed eos architecto. Dolore voluptas qui quia porro dolores earum.
1429, 143, Placeat quidem cum est optio accusantium commodi minus velit. Aspernatur aut ut numquam assumenda consequuntur qui. Nihil aut ea provident.
1430, 143, Magnam animi quasi amet quod. Earum et quam vel vitae soluta perspiciatis. Rerum ipsum veritatis optio cupiditate et rerum laborum.
1431, 144, Vero aut sunt non sunt. Qui harum quam recusandae officia velit. Saepe ut rem quam delectus et voluptatem quisquam quidem.
1432, 144, Fuga illo ea sed facilis nobis cupiditate ab. Sed iusto qui consequatur magni. Sunt officiis qui ut id ullam recusandae similique.
1433, 144, Eum dolore illo vel ducimus quae. Qui nostrum quis laudantium. Sint rerum est nesciunt.
1434, 144, Omnis et et distinctio. Enim suscipit at voluptatem. Explicabo voluptate ex omnis sint qui quia nulla.
1435, 144, Qui aut deleniti sed. Est amet eum in eligendi inventore. Id earum iusto dolorum consequatur et doloribus.
1436, 144, Aperiam iusto cum velit velit voluptates. Cumque impedit aut et qui ut quibusdam. Repellendus molestiae aut totam nobis repellat.
1437, 144, Dolor facere voluptatem occaecati dolor error nemo magnam et. Aut sed fugiat sunt quod. Quia sapiente sunt laborum distinctio atque sint quibusdam.
1438, 144, Ut repellat accusantium iure et et nihil. Ut ad voluptas temporibus aut non veniam. Et quia consequuntur cum voluptas placeat minima.
1439, 144, Repudiandae saepe suscipit ipsum aut. Modi quasi assumenda omnis commodi. Voluptatem et ipsam sed.
