1, 1, Culpa reiciendis molestiae voluptates eaque hic autem quo. Assumenda aut illo eveniet sapiente molestiae. Deserunt illo dolores molestias veritatis ea quis.
2, 1, Facere dolor et ratione. Minus id quo et maxime rerum quo totam. Sed fuga temporibus et dolor beatae reiciendis.
3, 1, Illum consequuntur eius laborum corporis sapiente eos. Nobis earum esse rerum aut neque vel voluptatem. Et quo eaque non cumque id.
4, 1, Esse ut nihil sunt aut quam aut voluptas. Sit pariatur provident omnis fugiat occaecati eligendi. Quas enim vero et qui earum.
5, 1, Ea rerum architecto ducimus. Distinctio nulla ullam cum ut dolorem sint. Sunt accusantium enim neque recusandae sint sint ipsam ut.
6, 1, Repudiandae sint facilis qui adipisci in. Dolore dolores sunt delectus ipsam velit fugit excepturi quae. Qui voluptas aliquid numquam mollitia repellendus.
7, 1, Dolores quia quia dolore autem ea at dolorem. Officia autem est dolorum inventore sed dolor consequatur. Excepturi incidunt sint recusandae debitis sequi et totam facere.
8, 1, Sit voluptas natus debitis sint fugit nemo. Quis quo aut ipsam enim eos incidunt. Sit harum commodi et.
9, 1, Est accusantium ea voluptatem officia velit labore reiciendis. Possimus vel dolores odio quia error. Nulla quis sequi qui consectetur consequatur.
10, 1, Repudiandae officiis est blanditiis fugit a eveniet. Iusto deserunt et laboriosam. Et molestias ullam molestiae eius consequatur illo commodi officia.
11, 2, Maiores sunt doloremque dolorem. Qui magnam ipsum magni reiciendis qui itaque. Ab qui qui ad.
12, 2, Maiores nemo culpa fugiat vero. Explicabo enim hic impedit nobis rerum recusandae. Molestiae sint ex voluptates exercitationem magnam quia omnis rerum.
13, 2, Ad quo aut laudantium odio dignissimos debitis architecto sit. Necessitatibus sapiente corrupti laboriosam architecto. Tenetur neque culpa maiores eveniet.
14, 2, Voluptate officiis dolorum vel ut expedita. Maxime nemo dicta rerum. Maiores reiciendis numquam ducimus.
15, 2, Vel saepe quam eaque. Dolores dolores accusantium quos dignissimos et. Autem qui facere voluptate reiciendis labore quae eveniet.
16, 2, Explicabo necessitatibus aspernatur ut. Dolor quidem similique vitae voluptate ut sit est. Recusandae ut et et.
17, 2, Voluptatum assumenda quaerat unde consequuntur et. Ea voluptatem sed numquam repudiandae. Tenetur ipsam quae porro et praesentium vel sed aut.
18, 2, Sint placeat quisquam cum quia tempore et. Quia eos qui qui nulla. Autem officiis aut voluptatibus.
19, 2, Veniam quia adipisci error ut. Repudiandae pariatur illo totam fuga quas sit. Voluptatem sit ut fuga sint quod.
20, 2, Dicta est laborum placeat. Id illo quis harum optio quis libero ab. Repudiandae ea vel possimus quis libero nemo dolor.
21, 3, Sequi est incidunt hic. Quae earum debitis rerum sint est excepturi. Perspiciatis delectus aperiam alias quam ipsam.
22, 3, Qui sint voluptate est ipsum. Velit quia saepe magni et. Ut sint accusantium omnis quae praesentium quo.
23, 3, Qui dolore nostrum ea assumenda repellendus consequatur. Eum omnis molestiae voluptatem qui. Qui et tempore fugiat porro quidem.
24, 3, Sint vero id sint labore sit qui est. Eum autem veniam voluptatem quia. Vitae consequatur dolor saepe fuga.
25, 3, Deserunt magni est error rerum atque. Et quo assumenda qui hic nihil possimus. Praesentium suscipit omnis quis doloremque eaque temporibus fuga nobis.
26, 3, Error eos iste temporibus voluptas quos alias aut. Quas ex numquam consequatur non est sint ut vero. Reiciendis aperiam possimus occaecati fugit et aut eveniet similique.
27, 3, Ea quis sit ab odio sed. Voluptates pariatur voluptas et impedit est sed commodi. Impedit quam nisi at asperiores.
28, 3, Nobis quaerat sed culpa illum et pariatur incidunt. Distinctio expedita autem magnam et tempora quia. Voluptas deserunt et hic amet dolor assumenda dolorem blanditiis.
29, 3, Qui voluptate et magni voluptatem architecto. Voluptatibus et est quia sint. Sed nisi dicta totam voluptatum repudiandae deserunt nihil.
30, 3, Consequuntur modi et et aut incidunt quia perferendis. Mollitia qui nisi sunt atque. Necessitatibus velit nam recusandae ullam quia dicta modi libero.
31, 4, Consectetur voluptatem quibusdam laborum enim. Qui numquam quibusdam ea iusto doloremque et quas dolore. Sed rerum libero totam beatae eum quasi.
32, 4, Et rem et sit. Nihil in non et ut. Vel molestiae eaque quia aut ipsa.
33, 4, Pariatur eos alias nesciunt consequuntur deserunt magni ea. Sit quisquam animi ut dolor ad beatae. Facilis minima reiciendis quaerat sunt alias eveniet similique quos.
34, 4, Nam expedita voluptates necessitatibus sapiente. Omnis quidem consectetur ipsum quia harum autem aut sed. Animi et architecto aut assumenda dolores quo qui fuga.
35, 4, Doloremque itaque nobis veniam totam sed nihil. Quibusdam rem et nostrum necessitatibus sit et. Occaecati a deserunt corporis iste enim sequi.
36, 4, Repudiandae qui nam sapiente a. Distinctio blanditiis perspiciatis animi. Temporibus est in deserunt quia quos.
37, 4, Quae consequatur voluptas iure. Est nam aut facere est aspernatur maxime et. Eveniet quidem a aliquid.
38, 4, Est doloremque libero vero itaque illum dolorum. Minima magnam amet possimus eligendi a libero deserunt qui. Corporis vero quia dolore quia est explicabo eos libero.
39, 4, Est assumenda veritatis expedita ut non officia repellat. Aut quidem eum exercitationem saepe ipsam. Dolor sunt soluta est iste architecto blanditiis similique.
40, 4, Et occaecati perferendis quibusdam doloremque consequatur. Saepe sequi odit et fugit hic dolorum. Expedita fuga omnis veritatis.
41, 5, Aut recusandae nihil explicabo ducimus qui excepturi sed. Hic deserunt dolor quia. Architecto optio asperiores sed numquam voluptates natus sed.
42, 5, Voluptatem ut quo illum explicabo quia dolores suscipit harum. Voluptatem est consequuntur numquam earum. Molestias quos porro sapiente placeat quidem eius.
43, 5, Ad tempore debitis placeat officiis eligendi sit eius. Non non labore ea eos et enim ex deleniti. Dolor ut labore veniam quis nisi.
44, 5, Ea et quos similique aut. Odio sit nihil est pariatur ullam in. Aperiam et recusandae est eum et atque.
45, 5, Tempora rerum odit ut consequuntur dolores. Architecto cupiditate laborum odit possimus est itaque repellat ab. Commodi ipsa consectetur nostrum reiciendis provident dolor ut consectetur.
46, 5, Alias est quia placeat. Error aliquid repudiandae aut quo autem facilis. Eos aliquam voluptatibus illum cumque.
47, 5, Tempore temporibus cumque mollitia natus. Nihil commodi id culpa. Omnis iste est ullam.
48, 5, Impedit et nisi expedita sint amet et. Sed nihil autem ut et natus amet. Assumenda libero velit veniam.
49, 5, Placeat quam eligendi qui quo. Dolor harum expedita repudiandae quae facere ducimus sit ipsum. Et et aut velit est quia similique.
50, 5, Tempore beatae eaque quis quibusdam aspernatur quis. Non veritatis maxime quibusdam deleniti reiciendis aperiam. Blanditiis et non nihil quibusdam.
51, 6, Inventore qui repellat recusandae autem aspernatur tempora dolores. Inventore ullam itaque ipsam voluptatem ut rerum a eos. Animi illo saepe quis eligendi beatae in error.
52, 6, Voluptas iste enim ut exercitationem sit veritatis repudiandae. Laudantium vel et commodi tempora est ducimus. Consequatur at maiores repudiandae cum animi ipsum pariatur libero.
53, 6, Repudiandae explicabo consectetur architecto ut debitis architecto. Distinctio laborum et officiis neque ut dolorem dolore eaque. Dolores at eos odit iure quisquam.
54, 6, Illo sed a aperiam iusto qui facilis voluptatem eos. Ad fugiat placeat perferendis nostrum odit sit incidunt corporis. Animi eligendi quia fuga quasi suscipit optio debitis.
55, 6, Et placeat atque sunt. Facere enim et quia quasi. Sit deleniti iste aut enim dolorum.
56, 6, Qui nemo corporis vel quibusdam autem dolorum qui doloremque. Omnis doloribus quia modi necessitatibus reprehenderit. Aut maxime aut similique ut et voluptates dicta odio.
57, 6, Accusantium aliquam sunt est dolor. Quaerat qui et neque quas accusamus. Laborum est doloremque excepturi quam eos.
58, 6, Omnis sunt eius esse dolores minima mollitia. Facere ab consequatur magni nesciunt exercitationem dolorum cupiditate beatae. Accusamus inventore ea odio aliquid.
59, 6, Ea quia sit dolores vel non voluptates. Sit suscipit corporis cupiditate non dicta minima repudiandae possimus. Vel voluptates at et laborum.
60, 6, Explicabo et ullam minus. Delectus rerum reprehenderit sunt id alias dolorem. Perspiciatis mollitia ut eius recusandae quis ut voluptatibus eveniet.
61, 7, Ut praesentium officia nostrum et porro excepturi molestias voluptatibus. Quos doloremque inventore exercitationem et. Illum voluptatem consectetur vitae cum alias.
62, 7, Iusto blanditiis iure inventore. Magnam est sit nisi ut commodi vero vel. Exercitationem rerum porro qui eaque commodi fuga ratione exercitationem.
63, 7, Fugit et optio fuga. Facere excepturi quis placeat praesentium id veniam. At quo cupiditate quam.
64, 7, Id porro corporis earum. Illo alias aut dolorum velit enim neque qui iusto. Voluptas velit exercitationem deleniti reiciendis.
65, 7, Quam provident recusandae consequatur qui. Adipisci at cum corrupti nemo. Itaque natus voluptatem magni dolor et.
66, 7, Recusandae omnis ut laborum quis eius error perferendis. Expedita molestiae consequatur accusantium natus alias similique quod. Nihil ad consectetur voluptas vero.
67, 7, Porro ut quidem saepe explicabo enim distinctio dolores ut. Nisi esse blanditiis animi et. Soluta nemo in mollitia aut unde sit.
68, 7, Non totam iusto eligendi sed aperiam. Placeat sunt commodi error et suscipit ut. Adipisci porro nam ut est culpa.
69, 7, Qui repellat sapiente sequi natus. Rerum officiis ut quo voluptas. Ea molestiae nihil facilis omnis dolorum eius voluptates qui.
70, 7, Minima excepturi iure qui et qui id. Repellat similique amet hic non architecto minus aut. Sit sunt consequatur voluptatem corporis odit non ut error.
71, 8, Velit consequatur et officia beatae. Dolor et aliquid labore non qui mollitia quidem vel. Accusamus sed sed atque.
72, 8, Sunt voluptatem sed dolores dolor hic et assumenda animi. Quis sequi omnis ratione earum delectus et nostrum. Voluptas aut at et dolore ea.
73, 8, Cupiditate sed beatae ut dolores numquam mollitia et. Dicta aut et dolores eius. Libero quidem nulla nobis et incidunt distinctio eum.
74, 8, Maiores maxime est et et. Ut exercitationem aut in non atque quam. Illo ea natus est est voluptatem et voluptas.
75, 8, Consequuntur quidem voluptas impedit. Et veritatis harum maxime neque ullam et. Doloremque soluta quaerat eaque non iusto nesciunt eveniet non.
76, 8, Hic itaque et delectus. Voluptatem sapiente et rem. Corporis est suscipit ea necessitatibus est doloribus possimus.
77, 8, Qui mollitia quo eum tempore. Esse dignissimos qui similique non perspiciatis est ullam saepe. Molestiae enim reiciendis nemo dolores a nisi.
78, 8, Qui velit in explicabo. Odio minus laboriosam non repudiandae. Nihil magni pariatur sed doloribus quod rerum veritatis.
79, 8, Placeat et occaecati nihil at aut dolorem vel odio. Similique nesciunt fugit quo voluptatem dolor. Tempora non qui quo ullam ea iste sunt.
80, 8, Sequi delectus possimus aut sapiente et esse eum. Aut expedita corporis laborum non inventore et aut. Ex possimus neque quis quia similique aperiam.
81, 9, Aut aut ut perferendis id occaecati perferendis ex. Voluptas consequatur laudantium consectetur similique vel rerum. Et magni nulla quod harum enim vitae.
82, 9, Aut possimus et ex nemo animi id repellendus illo. Aperiam ab vitae adipisci enim culpa non quia. At odit corporis vel natus voluptatem et et.
83, 9, Vel et rerum quaerat ab et. Aspernatur dolore corrupti dolorem. Officia earum et quod.
84, 9, Ea quas dolorem iure laboriosam. Eum pariatur quis molestias. Dolor sit aperiam deleniti omnis.
85, 9, Qui non sunt est quo eum accusantium laborum consequuntur. Et et quidem eius alias ea neque voluptatibus qui. Ut aut nihil a quidem quibusdam eos dolor accusantium.
86, 9, In ut maiores ex provident quis sit et tenetur. Ut neque quo voluptate tenetur neque. Quos quod sit vitae.
87, 9, Impedit explicabo sint molestiae iure non incidunt id a. Neque ut facere consequatur qui qui. Expedita sapiente nulla aut optio ut ut.
88, 9, Qui odit nostrum quia incidunt minima. Debitis dolores quisquam et et magni qui rem. Et expedita tempore eaque dolor similique dolores accusantium.
89, 9, Qui nobis possimus voluptatem. Illo natus molestiae tempore molestiae expedita eos. Voluptas qui alias et aliquam iure.
90, 9, Corporis dolorum assumenda maxime omnis autem aliquid voluptatem. Voluptate non necessitatibus autem sed. Aperiam odit qui vero dolorem dolorem.
91, 10, Beatae quo vel omnis quam illum laudantium. Aliquid veniam veritatis vero et consequatur quaerat voluptatem et. Qui quo magnam ducimus.
92, 10, Dolorem ullam eos quis neque. Cumque perferendis debitis voluptate rem omnis quia. Sapiente sit sint dolores nihil praesentium unde.
93, 10, Ut rerum cum ut eligendi vitae. Beatae explicabo aut cum qui ipsam debitis nemo. Doloremque id sit et voluptatem omnis eveniet eius.
94, 10, Eos neque voluptas ut laboriosam accusamus mollitia. Maxime itaque rem voluptatem fuga doloremque harum architecto doloribus. Quis ex doloremque doloremque natus.
95, 10, Et iusto voluptates et. Et est aut illo in consequuntur. Doloribus ut praesentium alias eos.
96, 10, Natus veritatis nihil et officia. Nemo neque neque aliquam laudantium dolores facilis. Sed dicta est excepturi molestias nihil.
97, 10, Possimus enim neque quia illo facilis ratione. Rem tenetur natus pariatur inventore pariatur ut. Omnis dolorem vero sit quos animi eligendi.
98, 10, Est deleniti consequatur vel nisi. Aperiam molestiae minima consequuntur nemo delectus voluptatibus. Temporibus repudiandae aut cum et a.
99, 10, Voluptatem pariatur totam assumenda quos. Ipsum quisquam ut voluptas adipisci et molestiae dolor magnam. Veniam consequatur numquam tempora voluptas porro.
100, 10, Rem reprehenderit rerum atque est. Consequatur accusamus neque nostrum perferendis laborum deleniti est nobis. Suscipit at magnam similique ea officiis unde ratione.
101, 11, In facilis maiores eum deserunt dolorum deleniti aut sint. Ipsam sed velit provident distinctio rem explicabo. Quia cum dolor maiores in quia.
102, 11, Deleniti voluptas suscipit similique maxime a error adipisci voluptatum. Officiis harum sint officia consequatur quo ea voluptas. Earum mollitia quia perferendis ipsum nostrum ab est.
103, 11, Est reprehenderit voluptate expedita rem quas laudantium totam. Repudiandae omnis perferendis fugiat similique esse. Itaque recusandae sit officia ex nam.
104, 11, Aut ut fugiat quod consequatur est. Laboriosam et unde incidunt eum tempore sunt in qui. Iure et dolorum dolorem dolor voluptatum architecto atque.
105, 11, Aut eos consequatur perferendis tenetur aut. Sunt ullam est perferendis dolor ducimus ut et. Voluptas delectus nihil ut autem.
106, 11, Consectetur ipsum in ratione sit. Voluptatem nobis vel ut voluptatibus. Sapiente quo aut delectus excepturi atque quo voluptatem.
107, 11, Sapiente doloremque quia et esse beatae numquam. Fuga animi suscipit laboriosam placeat eius commodi. Laborum et omnis mollitia quasi.
108, 11, A est dolor voluptatem. Aut voluptas dolores magni eos in officiis est. Nobis error quo natus et cumque.
109, 11, Nisi nulla quos omnis. Qui consequatur iste laboriosam quidem ipsum vero fugiat voluptatem. Animi repellendus fugit tempore qui numquam mollitia illo nostrum.
110, 11, Voluptate illum praesentium quibusdam excepturi voluptatem placeat ut. Omnis eum et sed omnis necessitatibus quidem perspiciatis qui. Molestiae molestias quia soluta iste doloremque dignissimos.
111, 12, Dolor commodi incidunt facere est ut quia rerum. Itaque possimus doloribus corporis tenetur qui consequatur doloremque est. Aut doloremque a sint autem est omnis nobis.
112, 12, Quis libero voluptates quo non quaerat quia id et. Labore aspernatur eos omnis velit ipsam. Accusamus aperiam consequatur quae consequuntur sint atque fugiat.
113, 12, Blanditiis esse fugit aspernatur. Non quas corrupti velit in sit animi. Veniam dolor itaque facere.
114, 12, Commodi hic molestias reprehenderit rerum. Rerum consectetur ipsam tempora deleniti aut autem reiciendis. Ipsa adipisci sint pariatur adipisci soluta et odio.
115, 12, Sit dolores placeat quos eos at mollitia minima itaque. Illum culpa et culpa eum. Est sed enim impedit quia quo facilis.
116, 12, Blanditiis libero temporibus explicabo ipsa aut suscipit in quae. Aut rerum cumque numquam amet asperiores dolor amet qui. Labore voluptatum quo asperiores voluptates.
117, 12, Et assumenda est veritatis. Fugit aliquam nihil aspernatur provident aut. Ea dolorum molestiae suscipit omnis ut repudiandae earum et.
118, 12, Illum in ut corporis excepturi voluptas maxime et ut. Totam et eos qui voluptate magni omnis. Voluptas nemo vel molestias praesentium.
119, 12, Maxime perspiciatis doloremque officiis. Velit quia ipsa est itaque velit at. Saepe ab officiis atque provident nesciunt sunt asperiores.
120, 12, Beatae voluptatibus sit voluptas quo. Quia laudantium molestias delectus aut tenetur quo alias molestiae. Consequatur itaque non voluptas et qui tempora qui.
121, 13, Corporis tempora iure non. Sapiente veniam ex dolores ut. Delectus aut dicta eius.
122, 13, Nisi error quos vitae id similique. Soluta rerum enim accusamus voluptatum reiciendis. Laudantium eligendi est ut temporibus debitis.
123, 13, Aperiam illo hic est blanditiis et quam aut. Occaecati et minima itaque laborum magnam eum itaque. Sit nemo at tempora voluptatem sapiente ea.
124, 13, Qui ea ex consequatur. Quidem deserunt non atque incidunt unde est. Nulla error iure non accusamus.
125, 13, Tempore provident necessitatibus tempora ullam eos. Esse aspernatur sed nulla rerum harum. Et iste magni pariatur inventore possimus adipisci autem dolore.
126, 13, Vitae dolores labore eos voluptatum magni reiciendis. Perspiciatis quae autem nostrum. Vel illum earum odio sapiente ea ipsa accusamus.
127, 13, Qui quibusdam vero consequatur repellat ut non quo. Sunt molestiae quo nam delectus eligendi sed. Similique hic accusantium laboriosam consequatur et.
128, 13, Reprehenderit magni culpa modi similique aut. Ratione fugit animi commodi aperiam qui. Corporis vel sapiente praesentium alias ipsa mollitia.
129, 13, Velit earum atque accusantium nulla fuga rerum cumque ut. Illo et dolor sint praesentium reiciendis. Qui excepturi perferendis corporis.
130, 13, Ut molestias fuga sit aut quia enim ex nihil. Doloribus et atque dolorem neque odit. Consequuntur quod nostrum culpa voluptas.
131, 14, Aliquid quis tempora neque. Iusto in qui quaerat. Nihil minima perspiciatis voluptatem odit saepe.
132, 14, Sunt qui omnis vero ut. Alias rerum inventore nemo aperiam aut. Vel eos dolorem dicta.
133, 14, Alias illo reprehenderit et eos expedita. Aspernatur sint odit aut ea. Ut blanditiis eos ipsum aspernatur.
134, 14, Commodi sint fugit et est quia. Optio saepe et quibusdam earum. Nemo quidem vero consequuntur eum iure illum saepe eum.
135, 14, Vel sapiente explicabo assumenda voluptatem inventore voluptatem non assumenda. Ut dolorum modi corrupti soluta tenetur et consequuntur nobis. Velit voluptas amet debitis sapiente dolorem consequatur quis.
136, 14, Aspernatur in ipsum unde vitae laudantium esse. Rem et quisquam eos eius sed ut nihil omnis. Corporis fugit maxime numquam maiores quas vel necessitatibus.
137, 14, Excepturi est rerum laborum. Eius dignissimos accusamus aut eveniet quia cumque corporis odio. Molestiae ut sit laboriosam nostrum id doloremque voluptatum.
138, 14, Quam omnis quos exercitationem dolorum aliquam autem. Autem mollitia voluptatibus delectus. Impedit qui provident est.
139, 14, Nostrum ut corporis id atque. Rerum nihil et assumenda corrupti provident. Alias ea non quos ducimus recusandae id.
140, 14, Ut quo dolorum est repellendus eos et et id. Unde et ipsum officia reiciendis repellat. Minima ullam vitae commodi provident reiciendis.
141, 15, Dolor architecto rerum harum. Enim odit maiores necessitatibus facere vel. Eos officia possimus perspiciatis excepturi reprehenderit voluptas et.
142, 15, Deleniti magnam quis numquam. Tempora consectetur vel excepturi aliquam consectetur deserunt. Animi nam officiis recusandae.
143, 15, Consequuntur consequatur iure sint perferendis eos facilis iure deserunt. Corrupti libero quis provident sunt recusandae temporibus vel. Consequatur nihil asperiores sit.
144, 15, Accusamus qui rerum consequuntur sunt a quasi id possimus. At tempora nostrum assumenda unde. Qui tenetur sunt porro velit rem ab omnis.
145, 15, Non autem est sapiente enim qui dolorum. Qui nihil et non minima voluptatibus. Minima voluptas quidem qui dicta non.
146, 15, Aut architecto vero voluptatem atque fuga perferendis et. Cum animi eius voluptatibus est adipisci rerum ut ipsum. Ut id in eligendi consectetur.
147, 15, Reiciendis temporibus quasi eveniet laborum et iure qui. Maxime mollitia rerum blanditiis saepe. Voluptatibus ut vel fugit quia molestiae deserunt.
148, 15, Praesentium sint odit aut est odio sunt quisquam inventore. Aut pariatur et maxime exercitationem et consequuntur. Autem reprehenderit est quis odio est quo neque aut.
149, 15, Maiores qui quaerat non ea consequatur et. Voluptatem corrupti iusto iste nam. Qui illum consequatur impedit.
150, 15, Beatae dolorum nesciunt et. Natus excepturi ut voluptatibus assumenda. Dicta perspiciatis omnis qui labore.
151, 16, Labore et omnis doloribus quisquam quaerat occaecati possimus. Quia quis architecto est id corporis commodi odio vel. Incidunt molestias enim nostrum et.
152, 16, Quo commodi quia vitae cupiditate quos aut et. Rerum laboriosam quibusdam qui doloribus quae totam et. Ullam at accusamus iusto atque aut maiores.
153, 16, Minus officiis enim ut deleniti. Pariatur accusantium aspernatur similique labore et eos expedita. Fugiat non sit repellat corporis minima eum dolores.
154, 16, Illum a repellat sunt in possimus. Ipsam vitae totam officiis non. Aspernatur praesentium quos ut praesentium quibusdam quisquam ut est.
155, 16, Modi minima nostrum ipsam vel voluptate sed sit. Quis debitis tempora itaque temporibus doloribus et. Veritatis dolor veritatis ipsa aut ut voluptate temporibus minus.
156, 16, Omnis voluptatem error et veritatis labore doloribus et ut. Fuga laborum reprehenderit numquam quam omnis non. In est sapiente impedit consequatur saepe facere dolor ut.
157, 16, Dolor voluptatem dolorem qui. Dignissimos excepturi et in quo. Magni et ipsam est officiis vero.
158, 16, Qui nostrum impedit cumque adipisci et voluptatem repudiandae quia. Doloremque consequatur consequuntur velit aut et odit cupiditate qui. Quos hic ipsum non dignissimos.
159, 16, Eum voluptatem deleniti et minus consequatur qui. Voluptatem quo suscipit modi consequatur fugiat. Laborum doloribus consequatur qui error illo quo.
160, 16, Omnis eaque veritatis quae odio architecto. Ea quibusdam ipsam similique sed eveniet maxime. Sed ea laudantium rem.
161, 17, Rem laboriosam ipsum sapiente odio labore asperiores. Fugiat occaecati delectus ratione facilis. Dolorem dolor laborum aperiam placeat omnis numquam.
162, 17, Adipisci illum minima corrupti facilis harum fuga minus accusantium. Sed sed qui et eos aut illo. Consequatur deleniti tempore eligendi dolores quos omnis ea.
163, 17, Et repellendus corrupti sit nulla unde excepturi sint nihil. Aspernatur saepe odio soluta velit reprehenderit animi culpa itaque. Natus qui nam incidunt laboriosam dolor esse.
164, 17, Omnis magnam occaecati aut et. Voluptatem reiciendis et itaque adipisci possimus dolor perspiciatis omnis. Perspiciatis quos saepe hic aut.
165, 17, Omnis fugit nesciunt occaecati. Est sapiente odit perferendis vero accusamus voluptatum quis ipsam. Dolorem et et optio non perspiciatis.
166, 17, Fugit rerum odit voluptas dicta excepturi aut. Sit ad facilis voluptatibus cupiditate eum omnis blanditiis ratione. Velit deleniti quae est laborum.
167, 17, Sunt non sit eos corporis esse rerum consequatur. Animi voluptas modi adipisci. Qui animi atque rerum ipsam magnam.
168, 17, Et dolor corrupti dolore et recusandae eum quo aliquam. Debitis et omnis illo. Et corrupti architecto accusamus facilis exercitationem eligendi architecto delectus.
169, 17, Dolorum asperiores accusantium dolorem et sed quo. Et quis esse aspernatur distinctio. Nihil eum et dolore fugiat.
170, 17, Omnis asperiores sit voluptas neque rerum ut omnis. Aut ut est cupiditate repellendus perferendis fuga. Facere perspiciatis similique odio modi itaque et architecto mollitia.
171, 18, Totam non quo officia et est sunt. Nemo reiciendis esse magnam ut. Commodi eum harum inventore est.
172, 18, Voluptatem in quaerat ut sapiente. Libero possimus debitis impedit nemo. Voluptatem esse molestiae facere accusantium et autem.
173, 18, Aut vero est sapiente ipsam voluptatem. Consequatur voluptas pariatur pariatur repellendus in. Sunt deleniti provident unde molestiae sapiente.
174, 18, Autem non dolorum odio sed earum aut. Mollitia adipisci tempora nulla perferendis velit doloribus. Et rerum quas iusto.
175, 18, Aspernatur ea quod dolorem neque cum aut dolorem tempore. Rem quasi quia temporibus pariatur sed maiores sint voluptatem. Est in ut voluptatem a omnis ipsum repudiandae.
176, 18, In fugit sint similique itaque sint laudantium. Quis unde illo maxime. Quis et provident soluta corrupti est neque sunt.
177, 18, Nemo nostrum et vero placeat aut natus. Magnam dolores sint possimus. Unde ut rerum minus a rem.
178, 18, Exercitationem beatae nam sed ut. Saepe architecto expedita veritatis sequi aut voluptatem. Vel sit quo ducimus error qui.
179, 18, Fuga nesciunt modi cumque nihil. Pariatur in dolorem nulla et vero. Velit expedita vitae itaque amet.
