2510, 251, Facilis sint molestiae nesciunt maiores et velit voluptas nam. Quia repellendus quasi velit. Provident eveniet debitis excepturi eligendi ut alias aut qui.
2511, 252, Voluptatum repellat voluptas delectus. Consequatur sed molestiae vitae consequatur iste. Velit est labore sapiente temporibus rerum.
2512, 252, Consectetur provident ea temporibus et sapiente nam. Sunt tempora est ut nihil aut. Consequatur rerum aut doloremque doloribus.
2513, 252, Est quia excepturi perferendis mollitia quam. Magni facere esse suscipit impedit sunt. Et qui laboriosam ut dicta est voluptas.
2514, 252, Alias debitis deserunt non consequuntur repudiandae non. Necessitatibus at fugiat laboriosam aliquid omnis consequatur dolores. A ratione magnam voluptatem iste voluptates nobis.
2515, 252, Ipsam sit omnis fugit. Nam doloremque totam sint. Neque mollitia fugit ex.
2516, 252, Dolor qui est neque molestiae. Molestiae magni aliquid dicta laborum minus. Est ipsa sed et voluptatem.
2517, 252, Possimus harum ea deleniti minima eum. Rerum quod non sit qui quam. A doloribus cumque voluptas eos eum dolor sit.
2518, 252, Aperiam ab autem est. Quae dolorem dolorem quia est enim dolor. Ut in accusantium voluptatem et et provident voluptatem.
2519, 252, Dolorum tempora aut quia. Asperiores sunt tempora corrupti ut earum mollitia est voluptas. Exercitationem aut voluptas esse.
2520, 252, Ipsa non consequuntur a rerum rerum. Harum ea iure et blanditiis. Deleniti repudiandae voluptates doloribus sed tempore deleniti eum consequatur.
2521, 253, Eius maxime voluptatem exercitationem suscipit blanditiis fugiat. Quos quae tenetur repudiandae quidem quam temporibus officiis. Quae et accusantium qui et et atque tempora.
2522, 253, Sunt commodi deleniti quam cum a qui recusandae. Expedita non et commodi pariatur qui. Nemo illo commodi rerum veritatis aliquam.
2523, 253, Aperiam numquam qui fugiat in omnis. Voluptatibus aut ea illo dolorem modi maiores. Et sit dolores est quo eaque ratione qui et.
2524, 253, Odio voluptatem quos sapiente qui. Porro velit ullam ducimus et ducimus nam maiores provident. Voluptatibus consequatur animi ratione sequi totam dolorem.
2525, 253, Corporis nihil maiores dolore. Voluptatibus voluptatibus consequuntur perspiciatis voluptatem culpa expedita dolores. Sed dolor totam ullam dicta debitis quis praesentium sed.
2526, 253, Vero velit pariatur ut. Incidunt alias harum iste molestias accusamus qui. Ipsum adipisci commodi vel quam mollitia doloremque inventore est.
2527, 253, Qui necessitatibus est est sed numquam ut modi. Delectus iste rerum rerum necessitatibus impedit vel. Sequi debitis corporis impedit quod quasi deleniti.
2528, 253, Non pariatur reprehenderit sequi laborum consequatur nihil. Sequi quod perferendis voluptas aliquid dicta qui at. Vel aut ducimus maiores consequatur totam et est.
2529, 253, Placeat et aut optio ut occaecati. Alias velit iure est. Labore rem quidem quaerat dolorum vel a.
2530, 253, Rem ipsam molestiae facere ex esse. Nisi consequatur quas qui maxime eveniet et. Eligendi voluptas repellat repellendus et fugit.
2531, 254, Sunt sint quisquam itaque eos quia asperiores qui voluptas. Saepe vero deserunt perferendis inventore ut dicta blanditiis temporibus. Quos cumque eos ullam et et.
2532, 254, Aut necessitatibus iusto modi quia. Eligendi vero sunt iure error sint et repellat maxime. Ut laboriosam corrupti dolorum reiciendis laudantium sed.
2533, 254, Et eligendi iste voluptas incidunt molestiae sed qui. Velit iste atque cumque esse excepturi nobis. Neque totam possimus eius consequatur.
2534, 254, Praesentium quis eaque nobis asperiores natus. Neque voluptate sed dicta a. Enim quod iure aut delectus.
2535, 254, Officiis ad fugit ut quam voluptatem veritatis facere. Quisquam quia non aliquam velit voluptatibus est odio ab. Suscipit ex atque sint at aperiam voluptates.
2536, 254, Tenetur quia quia ratione quos et explicabo quasi. Sed sint esse inventore qui. Dolorem reiciendis consequatur error velit.
2537, 254, Est ipsa et doloribus corporis eligendi ipsa. Blanditiis aliquam sit ullam quisquam eos. Et magnam aliquam in laborum in ut.
2538, 254, Minus amet sint mollitia dolorum sunt. Qui dignissimos omnis quod illum cum ipsum. Quis dolor expedita voluptate molestias sequi.
2539, 254, Fuga et maiores sed. Cupiditate dolores et exercitationem facilis quibusdam. Est quam ipsa qui aut voluptates sunt.
2540, 254, Et harum similique ut aspernatur rerum nobis tempore ad. Iste minima et repellat tenetur et dolores. In sed ut debitis quia architecto est.
2541, 255, Et expedita et eos aperiam dolore quaerat aut non. Quia distinctio quia aut aliquam non. Sequi perferendis optio aliquid consequatur consequatur in.
2542, 255, Iure officiis ut mollitia et laudantium minima et sapiente. Et laborum quibusdam ex provident exercitationem rerum totam. Magnam ullam dicta unde officia tempora consequuntur perferendis.
2543, 255, Quia cupiditate voluptatibus est nesciunt repellendus modi cumque. Quod esse doloremque enim non soluta voluptatem. Veritatis voluptas eos ducimus.
2544, 255, Aut quasi minima magnam sit aliquam est suscipit dolorum. Quis ea quia eum debitis. Qui voluptates voluptas non excepturi magnam incidunt.
2545, 255, Qui rerum maxime corrupti tempore. Rerum autem est animi consequatur fuga omnis. Ipsa tenetur autem earum.
2546, 255, Vel laudantium fugit repellendus maxime sint. Rerum harum occaecati sit aliquid id et minima sed. Aut aut culpa consequatur neque.
2547, 255, Magni at dolorem magni aut. Magni fuga illum voluptatem sequi voluptatem est ea. Tempore aspernatur tenetur aliquid est hic rerum voluptates.
2548, 255, Quae aut necessitatibus et. Rem ex dolores veniam nisi est eius. Modi alias est quas est recusandae autem.
2549, 255, Vel ratione consequatur fugiat velit in. Delectus eos amet voluptas vel libero reiciendis omnis voluptate. Minus nemo quis quia cupiditate sequi adipisci.
2550, 255, Est fugiat sed suscipit et. Dolores sunt nihil et similique quas qui accusantium sunt. Vel dolorem provident et dolorum qui.
2551, 256, Quibusdam itaque totam facilis quia eius. Ea nemo et quos consequatur et. Enim maxime cumque qui minus.
2552, 256, Repellat id non molestias nihil itaque. Ut totam architecto voluptate quae maxime neque. Aut quas voluptatem voluptas et quaerat eligendi voluptatibus ullam.
2553, 256, Provident quis suscipit et aut corporis id. Quidem mollitia quo facere. Non ipsa et quia debitis recusandae iusto.
2554, 256, Similique quibusdam commodi consequuntur occaecati. Rerum excepturi odit magnam non laudantium sit. Nisi non aliquid quia aut voluptatem praesentium.
2555, 256, Beatae voluptas et reiciendis et sit ut. Temporibus a et maxime deleniti nesciunt molestias laborum. Minima iusto iusto animi voluptas et esse blanditiis qui.
2556, 256, Consequatur porro perspiciatis enim. Et deserunt suscipit rem eaque delectus quasi voluptatem. Mollitia commodi est molestiae possimus fugit iusto alias voluptatem.
2557, 256, Delectus cum quo dolorem adipisci aperiam sunt ea. Aut ut voluptates magni odit voluptate repudiandae. Et consequatur itaque eum est libero voluptas necessitatibus autem.
2558, 256, Dolorum et voluptas sed aliquid expedita possimus magnam. Ex repellendus pariatur saepe sit suscipit perspiciatis qui reiciendis. Optio cumque distinctio ducimus voluptatibus laboriosam.
2559, 256, Voluptate adipisci quo deserunt ut sint vel eos. Ab ducimus recusandae tenetur quidem consequuntur voluptatem. Reprehenderit dolores nihil eius quos vero.
2560, 256, Recusandae temporibus omnis quos similique nulla sit in voluptatem. Et sunt tenetur error ex est. Tempora maxime et sequi in.
2561, 257, Repellat laboriosam sint quo mollitia nostrum sit. Nostrum doloremque cumque deserunt tempore. Assumenda odit quisquam a aspernatur commodi aut consequuntur magni.
2562, 257, Repellat earum adipisci molestiae reprehenderit laborum. Sed iusto rerum placeat quia. Soluta et harum quam numquam in quidem illo est.
2563, 257, Et est doloribus assumenda quia doloribus similique et id. Quia quae eum quo. Error saepe est consequatur facere eveniet est omnis corporis.
2564, 257, Officiis aut ab doloremque in voluptates consectetur. Quis consequatur perspiciatis maxime expedita reprehenderit. Numquam fugit dolore quis deleniti dolorem in deserunt.
2565, 257, Aut cum nisi at. Sit sequi minima et consectetur ad. Suscipit harum nisi voluptate.
2566, 257, Voluptatem quae vero et dolores ut consectetur id. Suscipit quis fugit provident. Voluptas dolores quo inventore praesentium voluptatem et.
2567, 257, Ut accusantium et repudiandae quisquam qui. Culpa nesciunt est iusto sed quis. Et nihil blanditiis vero non voluptate.
2568, 257, Fugit ut saepe illum aperiam. Odio dolorem impedit qui. Accusamus ut ut id.
2569, 257, Omnis omnis eaque nihil et est provident. Cum hic consequuntur autem rerum fuga. Molestiae et eius perspiciatis aspernatur blanditiis quis repudiandae.
2570, 257, Quis tempora occaecati earum porro temporibus nihil optio aut. Numquam soluta ipsam harum nostrum explicabo soluta et. Ut laudantium est aut sunt ad soluta.
2571, 258, Quidem dolorem veniam nostrum in debitis dolor. Omnis et ducimus blanditiis quae eum accusantium. Inventore aut ut quod beatae nobis.
2572, 258, Non repellat dolor nobis natus vel et dolore. Eaque repellendus quisquam et non quam. Pariatur dolores perferendis sapiente est dolorem ut.
2573, 258, Ullam nisi pariatur dolor. Sint voluptatibus recusandae vel velit voluptate nihil dolores qui. Qui ea velit hic.
2574, 258, Doloremque odio et ad repellendus quam adipisci. Sunt et tempore veniam et qui ut autem libero. Fugit dolore qui accusamus nostrum.
2575, 258, Voluptas commodi nam nostrum possimus voluptatem esse aut quam. Consequatur repellendus officia occaecati molestiae corrupti magni ut. Sapiente corporis non asperiores ut ea debitis commodi quod.
2576, 258, Consequuntur accusamus sapiente fugit dicta consequatur. Laudantium dicta quas eos laborum ratione. Veniam sint dolor temporibus.
2577, 258, Et in id vel sequi a dolor cupiditate aut. Ipsam nulla occaecati itaque tempore fugiat vel. Laudantium libero optio voluptatem totam dolor magni facere.
2578, 258, Dolores quibusdam eius labore qui dolor neque necessitatibus quasi. Rerum consequuntur voluptas iusto debitis. Voluptates voluptatem odio facere enim distinctio iure sit nemo.
2579, 258, Eius repellat porro dolore nam. Esse autem cupiditate voluptas similique. Et nam eveniet nostrum qui similique consectetur quo.
2580, 258, Dolorem est dolorum corporis et. Alias est qui est accusamus et qui nemo. Laborum veritatis nemo alias.
2581, 259, Impedit et at officiis est magni impedit. Id sed harum corporis voluptatibus. Pariatur voluptates aut consequuntur quibusdam ut ducimus placeat.
2582, 259, Nemo blanditiis incidunt cum et commodi a. Culpa debitis qui labore fuga et labore quis ratione. Animi molestiae dolor praesentium rerum id.
2583, 259, Quia corrupti quisquam est iste adipisci. Eos quia quibusdam quod dolor autem ducimus ratione et. Et voluptas quod vel praesentium ratione.
2584, 259, Consequatur ipsum officia fuga recusandae. Ex soluta sequi rerum vel accusantium hic nihil et. Quidem fugiat quod excepturi cumque nisi.
2585, 259, Et libero autem omnis in est possimus quas. Labore pariatur corrupti beatae voluptates quos ipsam vel. Iste perferendis quasi tempora architecto sint veritatis ut.
2586, 259, Consequuntur qui ullam laudantium iste voluptatum vel. Ea vero et debitis iusto et. Ipsa beatae sit optio illo sed laboriosam et vel.
2587, 259, At quasi aut enim soluta assumenda dolorum. Quas et rerum a voluptatem omnis facilis atque cumque. Expedita et eaque corporis velit sed laudantium dolorem pariatur.
2588, 259, Veritatis excepturi magnam totam sint aperiam doloribus esse quisquam. Magnam officia ut sed non aut laboriosam animi aut. Maiores facilis debitis dolores et sequi illo excepturi.
2589, 259, Quia libero laboriosam impedit perferendis voluptas velit. Repellendus voluptates veritatis debitis. Assumenda aut facere eveniet laboriosam aut deleniti.
2590, 259, Voluptatibus dignissimos consequatur earum et. Quo et voluptatem pariatur dolor ullam. Quaerat ipsum magnam qui placeat voluptatibus ad dignissimos.
2591, 260, Quia inventore dolor aspernatur laborum. Maiores assumenda molestiae quo sit. Mollitia tempora rerum voluptas.
2592, 260, Velit et est dicta voluptates quo. In quia ut impedit iusto occaecati quas. Ea perspiciatis suscipit consequuntur sapiente eum saepe pariatur.
2593, 260, Quod explicabo beatae voluptas et architecto. Velit est quo inventore possimus nostrum omnis nostrum animi. Maiores repudiandae laudantium ut aperiam.
2594, 260, Modi qui quae vel perferendis doloribus quia numquam. Magni quo ex qui est laboriosam et nesciunt. Qui sit aut expedita minima.
2595, 260, Molestiae repellat non autem doloremque nihil perspiciatis consequuntur facilis. Unde in ex accusantium quia. Culpa molestias neque occaecati et et.
2596, 260, Eius odit deleniti quos eum ut asperiores. Commodi veritatis quo non optio dicta. Et aut ut rerum magni et.
2597, 260, Delectus modi atque officia laudantium odit. Ipsam pariatur inventore in veniam quia. Vitae placeat est consequatur.
2598, 260, Temporibus ipsa consequatur cumque est in laborum in. Iure minima aut saepe error laudantium laudantium. Sint illum quia neque.
2599, 260, Qui neque quia repellat aut eaque nobis culpa. Quidem nihil omnis magnam debitis ut repellendus eos. Quam tenetur et sit sed voluptas officia nulla.
2600, 260, Quas pariatur nihil unde sed harum. Vel voluptatem qui ratione ea. Non architecto porro maiores eum corporis et.
2601, 261, Aliquam sunt quia voluptas velit. Architecto sint qui est. A labore reprehenderit id voluptatem ullam.
2602, 261, Debitis vitae nesciunt est in quas quis. Animi debitis voluptatem et molestiae optio. Voluptas aperiam qui aut laudantium impedit sunt libero quaerat.
2603, 261, Possimus natus eos quam. Accusamus neque excepturi necessitatibus inventore. Et non quia nihil perferendis minima deleniti porro voluptatem.
2604, 261, Cumque minus dolor quia perspiciatis aut qui. Quia voluptates magni est. Tempore esse consequuntur enim.
2605, 261, Sed laborum occaecati eveniet qui consequuntur quaerat et quidem. Ut iure voluptas hic voluptas vitae cupiditate. Voluptate rerum iusto necessitatibus nulla aperiam esse sed.
2606, 261, Iste qui quasi dolores cupiditate. Praesentium id similique architecto et consectetur et saepe. Id eos id nemo ea molestiae unde pariatur est.
2607, 261, Non illum et nostrum ut quia. Iusto enim ducimus natus. Dolor incidunt ab ipsum voluptatibus.
2608, 261, Officia saepe dolor consequatur deserunt perferendis non. Non enim ad in sit mollitia nemo nemo. Aut vero voluptatem aut laudantium et.
2609, 261, Doloribus omnis est excepturi vel corporis fugit. Sed dolores et nostrum nam tempora maxime omnis. Ea ut saepe porro aliquam animi molestiae expedita.
2610, 261, Velit dolores rerum perferendis assumenda. Quia ut consequatur ut aliquam perferendis ut. Est rerum inventore qui numquam quos dolor.
2611, 262, Eos repellendus voluptate quia nihil ratione molestiae. Minima esse voluptas quo facilis praesentium enim excepturi. Et excepturi ea cum omnis tenetur.
2612, 262, Rem ea possimus qui sit. Voluptas praesentium ut temporibus blanditiis sunt voluptatem voluptatem rerum. Dolorem delectus quidem est officia qui.
2613, 262, Et quo facilis at. Saepe aut fugiat quae assumenda. Enim ratione itaque corporis consequatur consequatur dolorem illo.
2614, 262, Aspernatur recusandae expedita nam sit. Ipsam similique explicabo qui. Illum sunt occaecati hic impedit ab dolorem.
2615, 262, Qui et aperiam unde tenetur libero quae. Illo minima nisi dolor molestiae blanditiis. Qui eum deleniti id voluptates distinctio.
2616, 262, Facere inventore et tenetur repellendus consequatur et atque. Aut et dolor et consequuntur. Qui et mollitia qui sequi enim aut.
2617, 262, Quasi sit ut in id. Voluptatem ut repellat repudiandae rerum ut perspiciatis. Repudiandae sed natus officia voluptatum consequatur ut sit.
2618, 262, Est voluptatibus dolorum ducimus temporibus aspernatur mollitia voluptate. Corporis voluptas tempora velit odio provident porro. Temporibus autem expedita vel est quod.
2619, 262, Nihil facilis maxime dignissimos et magni et magnam. Ullam eum ex quaerat fugiat commodi. Similique nesciunt explicabo veniam.
2620, 262, Dolores ut nulla est ratione ut. Aperiam aut repellendus amet nihil aperiam quia et. Doloremque vero quam commodi ipsa autem.
2621, 263, Rerum ea est voluptatem in totam. Explicabo occaecati aut quod. Unde est sapiente id.
2622, 263, Suscipit est ad illo iste saepe voluptatem minus voluptas. Maxime numquam quia hic. Iusto eaque architecto ipsam.
2623, 263, Commodi sunt quis amet et libero. Veniam necessitatibus rem perferendis dolores excepturi autem enim. Aliquam aliquam et occaecati eos in aut quis est.
2624, 263, Repellendus a temporibus consequatur similique nihil rerum consequuntur asperiores. Consequatur non nihil reiciendis illo adipisci non dolorum. Modi ducimus numquam enim officiis ex autem corporis et.
2625, 263, Illo consequatur sed non alias qui. Voluptas fugit sed autem dolore ut distinctio sed. Impedit ad est ea laudantium.
2626, 263, Quia fuga cupiditate rerum et corrupti. Eos officia voluptas numquam. Facilis id est repellat corporis aperiam voluptatem.
2627, 263, Voluptatem sint enim autem officiis voluptatem. Debitis nesciunt accusantium nobis est in atque porro. Ipsa officia cumque nihil et alias.
2628, 263, Ea sed beatae ut. Veritatis dolorem cupiditate qui unde eius odit tempora quia. Ipsum vel corporis harum temporibus nobis fugit et enim.
2629, 263, Atque pariatur deserunt corporis nobis. At consectetur quo beatae. Aut reiciendis quam eum.
2630, 263, Qui sunt delectus est eum amet vitae. Consectetur unde vel repudiandae eius qui. Et dolorum rerum amet maxime ut.
2631, 264, Facere et qui mollitia nulla. Repudiandae assumenda velit nisi labore. Iste voluptate ea minus alias consectetur.
2632, 264, Quibusdam hic tenetur officiis veniam aliquam. Nobis voluptas quasi et provident provident sed et distinctio. Dolores ipsam odit autem fuga nulla est.
2633, 264, Aut facere qui vitae a dolore. Nisi fugit facere molestiae quo nostrum magni vero. Ipsum ut et alias.
2634, 264, Aperiam provident non voluptatum illum optio est. Ut aut sed voluptatem. Aut exercitationem placeat eius officiis consectetur molestiae non.
2635, 264, Natus placeat earum expedita ut. Perspiciatis fuga corrupti aperiam reiciendis perferendis amet quia. Fugit ipsa temporibus et soluta delectus optio.
2636, 264, Dignissimos corporis veritatis qui perspiciatis. Quia nisi fuga rerum ab facere sunt a. Laudantium similique harum officia et rem.
2637, 264, Molestiae distinctio voluptate expedita voluptate dolore minima sed. Corporis aperiam autem et et aut est qui architecto. Possimus expedita quae libero aut occaecati dolorem.
2638, 264, Corporis doloribus sint libero iusto adipisci reprehenderit enim. Ut dolorem cum alias dicta earum est placeat dolor. A et sunt fugit asperiores quibusdam.
2639, 264, Repellat facere et quia est est. Sunt id voluptatem deserunt qui ut. Est ut quas et quidem aspernatur.
2640, 264, Accusamus soluta nobis ipsa at quia quos consequatur illo. Dolores et aut tempore maiores. Commodi et magnam pariatur distinctio in nobis delectus quasi.
2641, 265, Quos aut explicabo unde ut ea quae aliquam. Vel quas omnis quasi nisi ullam omnis vel recusandae. Magnam id laborum aperiam aut atque neque sed dolor.
2642, 265, Facilis rem fugit maiores odio et illo. Laudantium vel voluptatem quod illum tenetur. Minima nam exercitationem veniam est.
2643, 265, Sit incidunt impedit delectus aut laboriosam dolorem minima. Sed enim laboriosam accusantium velit. Mollitia et laudantium aliquam dolor.
2644, 265, Ut reprehenderit ad debitis est doloribus iusto et. Sunt molestias id nesciunt dolore quia. Aut saepe exercitationem et quia.
2645, 265, Suscipit soluta autem sit eligendi rerum cumque blanditiis qui. Iste reprehenderit et rerum. Fugit quia ratione optio fugit.
2646, 265, Reprehenderit veniam incidunt ut recusandae iusto ullam sequi. Minus quisquam est ut quia neque aut nam magnam. Soluta vero porro laborum ex atque qui nostrum.
2647, 265, Modi consectetur neque officiis at ratione. Et aut adipisci aut a rerum libero quis. Nihil explicabo vel rerum.
2648, 265, Eos qui suscipit reprehenderit qui aut dolorum aspernatur et. Placeat ut inventore dolorem commodi et mollitia sit maxime. Dolores aut repudiandae illum quasi exercitationem consequuntur accusantium.
2649, 265, Aut laborum aliquid sint facilis qui dolor. Voluptas id omnis sapiente doloribus ratione qui harum corporis. Quos voluptas dolor commodi soluta.
2650, 265, Ut et pariatur voluptatibus molestiae. Accusamus qui a commodi sapiente voluptatem quasi porro. Quo nostrum doloremque dicta et voluptatem rerum amet.
2651, 266, Harum laboriosam voluptatem inventore esse. Ipsa iste voluptatem ratione aspernatur est illum molestias. Iste placeat consequatur blanditiis quia quas eius.
2652, 266, Et et molestiae deserunt. Et vero nihil enim consequuntur ratione debitis. Animi recusandae dolor necessitatibus.
2653, 266, Nobis aut sed impedit in soluta debitis similique atque. Perferendis et id ex et voluptas consequatur. Ex nesciunt rerum praesentium quibusdam distinctio.
2654, 266, Quis quibusdam ratione consequuntur doloribus voluptas quo. Dolorem dolorum reprehenderit necessitatibus est consectetur omnis. Ratione voluptate deleniti consequatur voluptates officia maxime est culpa.
2655, 266, Pariatur vero illum praesentium dignissimos. Impedit sequi laboriosam non et dicta. Esse cum aspernatur sit repellat et maiores eum facilis.
2656, 266, Quod ea sequi laborum qui numquam sed. Fuga mollitia vel animi nihil nostrum at. Sapiente velit ex aperiam eveniet consectetur.
2657, 266, Et rerum aut quidem aut molestiae ipsum qui saepe. Et similique quasi vitae qui aut. Et sed quia et consequuntur ex dolores fugit.
2658, 266, Natus quaerat quasi libero. Necessitatibus quo non qui praesentium rerum. Numquam molestiae fuga aliquam explicabo minima quos.
2659, 266, Quia harum nulla dolorem. Placeat consequatur omnis sapiente fuga velit. Autem vel facilis repellendus.
2660, 266, Quasi eveniet aut voluptate delectus voluptatum autem animi. Id ratione in distinctio in nulla. Dignissimos minus nobis facilis enim ducimus beatae molestiae et.
2661, 267, Autem in iure accusamus. Voluptatem necessitatibus animi enim et rerum. Consequatur repellat quisquam illum omnis accusamus ut at illo.
2662, 267, Suscipit illo maiores nihil adipisci incidunt. Quis et eaque non dolores dicta dolorum corrupti magni. Sed dolorem vitae voluptate.
2663, 267, Aut reprehenderit repellendus atque. Occaecati molestias dolorem similique velit autem eveniet id assumenda. Voluptas facilis qui soluta.
2664, 267, Numquam debitis sit qui consequatur quod omnis alias. Est quas vero illum excepturi est expedita corporis. Et nam voluptate eos ratione ut.
2665, 267, Nihil quasi assumenda sequi molestiae in ipsa. Nemo et eius nihil quidem aliquam deleniti facilis facere. Consequatur nulla cumque laborum.
2666, 267, Non reiciendis dolores consectetur. Recusandae cupiditate et distinctio. Ipsa sapiente id doloremque asperiores non est cumque.
2667, 267, Sapiente aliquam nihil id consequatur tenetur omnis. Dolor consequatur non laudantium dolor est eum. Doloremque et et est.
2668, 267, Tempore qui perferendis debitis quia iusto atque nihil et. Esse optio voluptatem cum voluptate eum vitae sit. Facere nihil sunt qui sit culpa a nobis.
2669, 267, Consectetur molestias aut excepturi. Consequatur sed quia facilis nam vel sapiente occaecati minima. Et similique deserunt qui et doloribus sit.
2670, 267, Eum ut ratione quasi distinctio distinctio impedit. Dolores facilis ex velit cumque optio quo ut nesciunt. Atque ab ut fugit sapiente quod repellat unde.
2671, 268, Quos enim dolorum molestiae minus iure quas distinctio vel. Ea possimus sint a quidem repudiandae ut quam. Illum neque facilis ut delectus dolorum ea eos.
2672, 268, Mollitia in voluptatem dolores nulla id earum accusantium sed. Eaque sed laborum doloremque eius est et. Ut mollitia asperiores aut reprehenderit.
2673, 268, Voluptas corporis dolorum molestias ipsam. Architecto tempore omnis earum harum voluptatum. Itaque dolores rerum consequuntur rerum.
2674, 268, Voluptatibus quidem illum est perspiciatis. Placeat incidunt nam et. Ut et unde quos debitis dolor delectus facere dolorum.
2675, 268, Minus optio adipisci veniam consectetur tempora ut fugit. Facere numquam optio quam earum error eos ut. Necessitatibus est quae est.
2676, 268, Et eaque ratione et. Deserunt vitae necessitatibus in occaecati repellendus. Voluptate consequatur rerum placeat.
2677, 268, Rerum ea dolor temporibus velit eaque rerum neque. Quod sapiente voluptas modi consequatur illo. Exercitationem eius omnis qui non consequatur animi.
2678, 268, Incidunt rerum qui error. Ut magnam esse odit tempora eos qui dolorem quisquam. Deleniti quis aut sed eos sit praesentium eaque.
2679, 268, Iure nulla dignissimos nesciunt nisi sit autem aut quam. Provident veniam omnis quos officia. Deleniti nulla voluptatem est explicabo in.
2680, 268, Rerum voluptatum ut eos qui culpa in pariatur. Aut optio deserunt consectetur unde error tempora veritatis. Nostrum assumenda molestiae est officia.
2681, 269, Exercitationem iure natus alias earum sit dolor vitae distinctio. Quia error pariatur maiores quia amet libero reiciendis. Dicta natus accusantium debitis.
2682, 269, Voluptas sit assumenda est omnis. Sed distinctio et beatae incidunt voluptatibus alias. Totam quibusdam ex illum dolores laborum dolore cum.
2683, 269, Cumque architecto sint illo. Dolorum id aut quis tenetur atque et. Quam ut fugiat et distinctio earum.
