3738, 374, Quidem recusandae corrupti autem nam voluptatum sint corporis. Aliquam omnis voluptatem at. Quo sequi et voluptate atque quia ratione ut.
3739, 374, Nulla aliquid dolorem voluptatem et et eum ut. Quis et vel et velit nesciunt quia in natus. Sint magnam eum hic tempora sunt nostrum.
3740, 374, Quo neque sit et voluptatum quasi excepturi. Qui ut quae non sed ex. Quis molestiae porro voluptatem impedit quis.
3741, 375, Et alias facilis ratione deserunt sit. Sint mollitia ut iure tempore illum autem mollitia. Dolores dolorem sit ut numquam aperiam saepe.
3742, 375, Facere eius hic quasi ut. Sunt voluptatem adipisci excepturi dolores est consequatur suscipit aliquid. Dolore commodi vitae eaque incidunt voluptatem quas nihil et.
3743, 375, Unde eum est aut omnis voluptas consequuntur magnam et. Consequatur quia ut libero eius optio. Fugiat et accusantium fugiat ea molestias.
3744, 375, In maiores laudantium sapiente delectus alias in fugiat. A est qui dolor debitis adipisci tempore et corporis. Aut labore beatae a repellendus.
3745, 375, Possimus cupiditate debitis quo. Ipsum voluptas voluptatem aut. Aut officiis quis laudantium est.
3746, 375, Reprehenderit veritatis ut rerum asperiores vel. Doloribus quod numquam tempora est. Saepe saepe et in asperiores expedita fugiat.
3747, 375, Animi exercitationem ut praesentium est et molestias. Perferendis omnis nemo labore sunt. Nulla eos velit fugiat id exercitationem itaque.
3748, 375, Dolorum voluptates minima alias rerum voluptate labore eius. Accusantium molestias vitae tenetur incidunt est in dolore. Sit harum vel omnis voluptatum ipsum consequuntur voluptatem.
3749, 375, Quaerat adipisci nostrum quidem non ratione voluptatem voluptatibus. At tenetur sed provident ad provident ut doloremque ut. Est soluta recusandae nemo deleniti voluptas.
3750, 375, Quod a consequatur iste. Aut corporis eaque accusantium eveniet dolorum quisquam atque modi. Minima eaque aut eum adipisci.
3751, 376, Voluptatem blanditiis sit voluptatem similique nihil assumenda alias in. Molestias quia ut recusandae ut odio exercitationem voluptatem sed. Hic sunt nam sit enim quia molestiae.
3752, 376, Nam provident vel ullam natus consequatur ut et laboriosam. Voluptatibus repellendus eum porro. Officia necessitatibus placeat sint quia non est.
3753, 376, Aut eveniet quisquam corrupti impedit dolore voluptatum. Hic nihil doloribus soluta libero minus. Aspernatur et odit hic quis qui et.
3754, 376, Eos distinctio a vel laborum. Qui molestias quis ut sapiente. Ex ut nisi eaque quod qui commodi.
3755, 376, Exercitationem eaque sint itaque eligendi autem sequi excepturi. Qui id saepe ullam voluptas qui unde aut. Est eius esse commodi sequi omnis ad minus.
3756, 376, Sunt repellendus natus nulla optio non quaerat. Nostrum et occaecati in illum. Optio nostrum nemo omnis officiis vitae consequatur reiciendis nostrum.
3757, 376, Asperiores quia culpa sit odit ut enim. Consequatur deserunt molestiae omnis rerum. Unde atque alias magni aut velit.
3758, 376, Consequatur beatae dolorem corrupti aut. Et animi quasi fuga deleniti eum ipsam consequuntur enim. Inventore vero voluptatem aut minus sed at in.
3759, 376, Molestias deserunt tenetur ut consequuntur esse quasi qui expedita. Error quaerat unde omnis quod recusandae. Voluptatem ut rerum animi.
3760, 376, Rem similique error et quia qui nostrum aliquid esse. Et nostrum dignissimos quibusdam voluptate. Rerum veniam dicta corrupti harum ab magnam qui porro.
3761, 377, Ea velit consequatur dolore. Sit ratione et et. Vel ut adipisci veniam consequatur.
3762, 377, Id dolorem minima rerum molestiae. Voluptatem sed consectetur quam ea possimus eveniet quaerat vitae. Qui nostrum eveniet nesciunt.
3763, 377, Sapiente magnam consectetur ut enim. Soluta repudiandae deserunt aliquam eos. Est autem accusantium ducimus vel.
3764, 377, Aut qui sint fugiat nihil voluptas facilis non et. Ducimus in tenetur quia vero eos nobis facilis. Labore sit perspiciatis temporibus laboriosam officiis sed iusto.
3765, 377, Velit vel in commodi est repudiandae ducimus ex. Rerum suscipit aut a et illo possimus. Velit mollitia nihil quia in nobis dolorem.
3766, 377, Reiciendis quaerat eum sed. Eligendi totam molestias aut explicabo. Est et labore corporis velit repudiandae expedita quo vero.
3767, 377, Consequatur sed temporibus nam in est. Sequi quis consequatur veritatis natus incidunt. Dignissimos vitae necessitatibus minus.
3768, 377, Quia incidunt rerum magnam atque placeat maxime omnis aut. Consequatur nam id cupiditate delectus. Laudantium id maiores et.
3769, 377, Et a qui perspiciatis. Quia placeat numquam velit officiis doloremque. Magni quo quas voluptatem est.
3770, 377, Earum sint autem ullam quis facere. Aut laudantium dolores explicabo labore. Consequatur pariatur veniam nemo recusandae ea aut magni est.
3771, 378, Dolores quas non nihil blanditiis harum occaecati mollitia. Eaque ducimus voluptas voluptatem quia quia et. Et et omnis perferendis aspernatur dolor et.
3772, 378, Autem id non illum. Placeat rerum quia velit consequatur explicabo et voluptatum. Et sed corporis eos iure rerum quia quae.
3773, 378, In consequuntur accusantium non. Voluptas sed culpa quia. Ut error aut vel doloremque deserunt nihil.
3774, 378, Est alias nesciunt sequi nihil nobis reiciendis fugiat. Unde libero ea distinctio qui qui sint. At quidem dolorem deserunt illo.
3775, 378, Aut consequatur neque pariatur praesentium minima. Architecto ad nisi odit eos ut ullam est. Eum fugit quo aspernatur aut consequatur.
3776, 378, Et aut ut omnis dolorum blanditiis voluptatum. Qui sit rerum asperiores rerum. Dolor reiciendis voluptatem minima nam.
3777, 378, Omnis eveniet qui dolorum facilis tenetur sed eligendi. Repudiandae quibusdam dolorem sit impedit. Voluptas aliquam sed quia consequatur sit alias maiores.
3778, 378, Numquam aut cupiditate et veritatis rerum sint voluptates. Modi a hic qui earum perferendis ut. Nemo cum ad et asperiores qui officiis.
3779, 378, Quo vel libero blanditiis. Sequi eius sunt esse. Velit perspiciatis recusandae perferendis.
3780, 378, Pariatur dolores eum inventore. Quia alias neque animi. Aut repellat et impedit in sunt dolor ut.
3781, 379, Quidem ea dignissimos quaerat modi consequuntur tempore laudantium voluptatem. Aliquid ad sint sed a omnis nulla adipisci qui. Corrupti corporis est fugiat excepturi.
3782, 379, Quis veritatis accusantium assumenda aperiam ea vel. Aut eaque officia officia hic sed consequatur accusamus. Assumenda temporibus doloribus soluta.
3783, 379, Beatae omnis eos placeat ullam. Quo quisquam pariatur et ex aspernatur quas qui ut. Nemo quia veritatis voluptas quo accusamus.
3784, 379, Doloribus quia reprehenderit voluptatum fugit in rerum. Modi possimus distinctio pariatur voluptatem ipsa voluptate. Voluptates et facere numquam ut iure ipsum quod.
3785, 379, Quas et eos natus sit assumenda repellat. Quo autem sit recusandae molestias. Est voluptatibus neque unde facere.
3786, 379, Iste quia repellat eos explicabo minima. Iusto pariatur natus quam ipsa. Ex et nisi facere neque deleniti eaque beatae illum.
3787, 379, Quia neque qui alias ducimus voluptatibus a et repudiandae. Ea vel eius nemo accusamus consequatur. Qui ducimus quo veniam quae et repellendus numquam.
3788, 379, Vitae optio sint velit et beatae quidem veniam. Atque porro aut nesciunt odio est. Quo praesentium nesciunt soluta earum vel cupiditate.
3789, 379, Tenetur ducimus praesentium ratione eveniet consequatur qui. Id ex illum molestias voluptatem ea soluta sed. Accusamus dolore doloribus praesentium.
3790, 379, Reiciendis esse voluptate sed officiis esse. Fugiat perspiciatis aperiam quia qui molestiae itaque explicabo sint. Architecto tenetur omnis autem nihil.
3791, 380, Alias molestias rerum molestiae et qui modi animi. Beatae placeat dolorum vel dolores quas ut. Nulla modi quam eligendi ipsam ducimus sint maxime.
3792, 380, Nihil dolor laudantium consequuntur perferendis ut aut dolores. Ea maxime natus incidunt rerum ut qui error sapiente. Sit ea quis quod ratione et ut.
3793, 380, Blanditiis harum velit et. Consequatur non laudantium magnam exercitationem in cum officia velit. Dolorum est rem doloremque.
3794, 380, Quas fugit ea deserunt. Veniam esse ipsum et amet quis. Quos dolore rerum ad tempore voluptatem.
3795, 380, Voluptates fugiat qui dolore aperiam illo. Voluptas quisquam quia suscipit eaque fugit voluptas ullam. Totam dolor dolor facere voluptatum animi accusantium in.
3796, 380, Eveniet molestiae quo quos distinctio minus quae provident. Incidunt et sed expedita. Vel aut alias aliquid.
3797, 380, Temporibus non voluptatem saepe. Quas et eos nam. Sed velit sed molestiae cumque quis ut architecto.
3798, 380, Corporis quo aut possimus voluptatem. Veniam voluptatem aut temporibus totam asperiores eum occaecati provident. Recusandae fugit et eos ut ipsum iure impedit.
3799, 380, Consequatur et eius sint. Et dolore repellat consequatur quaerat itaque voluptate. Eum hic qui ipsum quibusdam.
3800, 380, Praesentium nesciunt asperiores est. Omnis dolores consequatur libero recusandae dolorum culpa voluptate. Veniam quibusdam qui et incidunt.
3801, 381, Odit magni aut adipisci dolor. Quod tenetur molestiae harum commodi dicta molestias voluptates. Esse neque adipisci non modi impedit.
3802, 381, Consectetur et temporibus sit laboriosam quia. Quia ex aut optio quas et temporibus. Ut accusantium blanditiis dolorem repellat aut vel voluptatibus.
3803, 381, Molestiae enim aliquam saepe. Ex minima quas ipsum. Minus alias tenetur vel molestiae.
3804, 381, Cum explicabo quia consequatur officia eveniet ut iste. Minima architecto quia sequi. Repellat aut reiciendis similique ea asperiores.
3805, 381, Accusantium aperiam fugiat voluptas ut et soluta. Voluptatem consectetur voluptas aliquam. Ea illo est praesentium.
3806, 381, Veritatis omnis tenetur consequuntur quod aut. Impedit tempora porro nobis autem eum molestias quo. Vel maxime quam sed corrupti.
3807, 381, Magnam non maiores optio ut alias. Voluptatum aspernatur fuga error minima dolor porro accusantium. Consequatur possimus consequuntur et sunt aut reiciendis in autem.
3808, 381, Reiciendis tempora ullam nulla molestiae vitae aspernatur aut. Sequi sit rerum debitis quia cum est. Eos inventore laudantium qui voluptas qui quisquam voluptatem voluptas.
3809, 381, Distinctio distinctio enim et eos. In facilis nulla eos ex vel. Autem cum voluptates voluptas.
3810, 381, Blanditiis earum ipsam laborum voluptas quam sint. Recusandae ut rem vel facere suscipit officiis facere. Qui cupiditate est odio in.
3811, 382, Ducimus vel omnis iure. Quod vel at aut quibusdam omnis voluptatem. Dolorem et quis beatae temporibus excepturi voluptatibus est soluta.
3812, 382, Quibusdam repellat cumque quos voluptatum veniam nam minus minus. Eum velit odit dolor exercitationem blanditiis. Quidem ut voluptatem alias molestiae ab enim.
3813, 382, Explicabo soluta architecto est. Consectetur possimus in reprehenderit numquam est fuga. Ab aut ut fugiat autem et unde temporibus accusantium.
3814, 382, Sunt totam sed suscipit voluptas corporis libero soluta. Iure eveniet accusantium veniam fuga eos. Et reiciendis quis veritatis amet quia exercitationem perspiciatis.
3815, 382, Ipsum pariatur voluptatibus nam. Corrupti et voluptas omnis alias nihil adipisci. Ea quia id molestiae quia omnis aperiam quia.
3816, 382, Aspernatur nisi dolor ut. Optio enim dolores repudiandae recusandae hic quis. Ratione perspiciatis illum dolore.
3817, 382, Autem dolores cumque exercitationem. Quia velit qui est earum ut temporibus nihil consectetur. Omnis omnis soluta quo.
3818, 382, Repellat rem ut magni itaque mollitia ut perspiciatis maiores. Et rerum esse omnis corporis. Officia quis et et et.
3819, 382, Aut aut beatae modi ut soluta. Eveniet error et ratione tenetur explicabo. Veniam consequuntur nisi enim fuga.
3820, 382, Eius officia ut dolorum voluptatem exercitationem. Qui illo et eum dolores laborum occaecati ut. Nesciunt aut porro quos et assumenda ad.
3821, 383, Sit similique consequuntur vitae qui. Molestiae voluptatibus doloribus non. Excepturi dolores saepe est non eum quidem culpa in.
3822, 383, Quis non beatae nobis vel eos accusantium. Sit amet voluptate dicta. Dolores sed in minus facere sint enim excepturi quibusdam.
3823, 383, Sapiente quia quas aut deserunt veritatis qui perspiciatis. Rem veniam velit omnis officiis. Eaque voluptatem rerum repudiandae ad.
3824, 383, Laborum sunt dolores incidunt. Ut fugiat velit voluptatem. Deserunt et nam nam.
3825, 383, Maxime error iste rem rerum et laborum. Ratione dolores tenetur illum sunt doloribus est minima. Iusto quo a mollitia illum aspernatur tempora quaerat.
3826, 383, Id molestias ut eligendi fugiat ut autem vero. Repellendus fugit nostrum modi et nihil odit omnis voluptatem. Veniam sit illum nulla aspernatur veritatis et adipisci et.
3827, 383, Ex repellat dolorum vitae. Qui dolorum voluptatem ut dolor nobis possimus reiciendis. Autem corporis animi distinctio.
3828, 383, Accusamus eaque totam eius corrupti voluptates. Et provident excepturi repellat fugit eos eaque voluptates non. Sunt quo est doloremque ut eum tenetur.
3829, 383, Cum id nobis praesentium. Deserunt quae ut dolor. Libero unde nemo velit fugit.
3830, 383, Nobis voluptatem quisquam et consequuntur optio non suscipit vel. Eligendi dolorum omnis nihil et illo. Numquam deserunt deserunt officiis.
3831, 384, Fugit omnis voluptatibus sint commodi velit sequi repudiandae vel. Consequatur sit consequatur dolorem voluptatem voluptatem ex beatae sit. Non omnis consequatur quis eligendi ea.
3832, 384, Aut optio aperiam fugit molestiae eligendi. Voluptatibus mollitia ea quia aperiam maiores. Quidem ut molestias perferendis.
3833, 384, Soluta non ut culpa sed architecto at. Voluptate et voluptatibus voluptatem aut. Dolores eos tempora amet asperiores reprehenderit quo aut saepe.
3834, 384, Reiciendis quia accusamus molestiae delectus voluptas autem at cumque. Ab est pariatur atque ut ratione. Voluptatibus delectus recusandae voluptas.
3835, 384, Ea illum qui vero in voluptas quas ullam occaecati. Recusandae ut autem qui. Perferendis temporibus rerum culpa sunt sit.
3836, 384, Ipsam nam distinctio sit consequuntur quis qui quia. Placeat ea aspernatur nam. Repudiandae commodi tempore enim soluta corrupti optio.
3837, 384, Voluptate atque quidem sit commodi. Libero ut et molestias deleniti quaerat laborum. Quae enim est et quo.
3838, 384, Dolores necessitatibus voluptatem earum. Perferendis quo accusantium et. Delectus rerum illo deserunt ut sunt similique.
3839, 384, Est velit qui nobis. Et fugiat harum repellat. Corrupti quasi qui est quisquam molestiae delectus cum quo.
3840, 384, Sit et eaque iusto vero. Sit aliquid voluptatem harum vero aut sint quisquam quo. Reprehenderit aut quos natus.
3841, 385, A autem non et at. Consequuntur consequuntur culpa omnis. Delectus consequuntur dolores esse molestiae et.
3842, 385, Expedita quis eligendi ut. Vero libero sequi culpa vel consequatur asperiores mollitia. Ut aut nihil blanditiis ut eos debitis.
3843, 385, Odit corporis mollitia aut maiores et et. Dicta omnis molestias ullam nemo culpa. Aut consequatur aliquid quia optio.
3844, 385, Aut possimus porro quibusdam quae maiores autem. Doloremque iusto velit saepe. Dolorem placeat architecto sed.
3845, 385, Quam incidunt dolorum voluptatem ut exercitationem. Aliquid dolore et et sit ipsum possimus ducimus excepturi. Quae iste repudiandae saepe.
3846, 385, Dolor totam dolores modi placeat dolorem quia sapiente. Alias est maiores perspiciatis. At quia beatae dolorem quae illo fugit.
3847, 385, Est expedita ipsam non architecto sint dolores. Eveniet unde quisquam dolorum aut ut voluptas. Id est cum et dolores.
3848, 385, Animi consectetur ut quisquam voluptatibus vero. Sit officia aut illo consequatur libero in corrupti quisquam. Commodi distinctio qui eligendi qui voluptas.
3849, 385, Nihil soluta repellat qui saepe odit dolores. Cupiditate aspernatur optio error sint libero impedit est incidunt. Illum eveniet sit ipsum.
3850, 385, Repellendus molestias quo tempora vitae quidem qui adipisci. Fuga sint sunt sed qui. Veniam laudantium quaerat accusamus mollitia nihil.
3851, 386, Et non a et. Ipsum qui excepturi quo et odit omnis. Omnis temporibus nesciunt voluptatibus et.
3852, 386, Et odio aliquam eum minus quis nostrum earum fugit. Fugiat dolore et maxime reprehenderit vero laboriosam omnis. Porro mollitia aut neque adipisci asperiores.
3853, 386, Quia ipsum excepturi minus quidem a maxime laboriosam. Illo iure animi nulla natus in et. Perferendis sunt minus velit dolores et non.
3854, 386, Molestiae accusamus adipisci odio vel. Officia voluptatum asperiores assumenda ut odit illo. Alias beatae libero et praesentium non.
3855, 386, Hic blanditiis eum qui quis qui quia. Perferendis aut corrupti corrupti aliquam at facilis. Ut possimus aspernatur eaque fugit cumque molestiae voluptatem.
3856, 386, Odio voluptatibus minima repudiandae molestias facere. Distinctio eum nostrum nulla temporibus mollitia dolores sed qui. Et est ut deserunt id iste excepturi.
3857, 386, Ullam animi aliquid deserunt. Aut deleniti magnam alias. Dolores at ipsam ex maiores sapiente totam ullam.
3858, 386, Culpa aspernatur est quia voluptatum molestiae. Est voluptatum amet sequi. Necessitatibus natus assumenda ab velit corporis aliquid quo dolores.
3859, 386, Eaque distinctio blanditiis odio repudiandae aut. Ut odio id hic quisquam. Accusantium cumque non culpa nulla.
3860, 386, Consequatur magnam temporibus labore. Quis adipisci perferendis soluta ab unde dignissimos. Deleniti culpa libero ipsam.
3861, 387, Similique nulla et nulla. Quasi inventore quia commodi quibusdam. Voluptas quo dolorem adipisci vel recusandae iure.
3862, 387, Eum laborum inventore qui quae. Asperiores voluptate nemo odio ut provident. Quo aliquam consequatur harum doloremque.
3863, 387, Nihil assumenda voluptatum aliquam quo veniam quibusdam quia tenetur. Sunt nam illo ea. Distinctio unde repellat animi eum eos vel fugiat.
3864, 387, Dolorem omnis est voluptatem nam. Error cum officiis ad ut quisquam placeat. Sit laborum laudantium non in qui repudiandae aspernatur optio.
3865, 387, Fugit voluptatem et qui nulla. Quaerat repudiandae pariatur voluptas ullam qui molestias inventore. Ducimus quia labore provident non.
3866, 387, Ut ad iste qui ea. Et quod deserunt nesciunt voluptatum ad et beatae. Deserunt excepturi placeat corporis mollitia.
3867, 387, Voluptas voluptates nemo id rerum. Qui veritatis sed deleniti. Architecto quis necessitatibus quis placeat sed sit vero ex.
3868, 387, Assumenda temporibus aliquid fuga a voluptas. Quaerat aperiam sed numquam eos quisquam. Quae autem autem eveniet numquam cumque ut.
3869, 387, Sapiente sunt esse asperiores pariatur natus est. Maiores optio quasi ullam illum. Quaerat tenetur assumenda id voluptate a ea et.
3870, 387, Illo possimus ab repellendus ipsum nesciunt quia et quo. Qui voluptas aut minima. Quisquam excepturi deleniti explicabo vero qui.
3871, 388, Unde vero enim ullam enim reprehenderit. Iusto qui voluptas mollitia labore nemo ipsum accusamus. Accusamus mollitia ut enim ut.
3872, 388, Culpa et in aspernatur voluptatem accusantium. Omnis magnam nostrum eum est. Et placeat voluptas ipsam.
3873, 388, Officiis unde in quisquam qui commodi dolores. Provident sapiente aut deleniti consequuntur at quidem omnis nemo. Hic qui repudiandae iure earum.
3874, 388, Recusandae voluptatem quibusdam fuga veniam optio qui. Officiis error sapiente ut soluta autem est beatae iste. Dolore quia assumenda neque molestias ratione id dolorem qui.
3875, 388, Eos incidunt ut qui ea distinctio. Illum fugit quisquam quas voluptatibus incidunt deserunt. Ea reprehenderit ipsum aliquid fugit hic id voluptatem.
3876, 388, Inventore alias consequatur corporis. Quia labore accusantium ab totam dolor nostrum officia. Ut sit perspiciatis quia omnis tempora.
3877, 388, Nihil natus debitis voluptates non maiores. Nobis labore repudiandae enim expedita et nisi. Et autem sequi laboriosam possimus aut repellendus quidem eos.
3878, 388, Culpa qui et cumque dolor ad laborum nulla. Quod qui minus corrupti officiis excepturi. Et tempore unde vitae.
3879, 388, Et et quae occaecati omnis. Aspernatur autem quia beatae repellendus vitae ut. Qui quia tempora officiis quos ut voluptates occaecati.
3880, 388, Voluptates atque eum deserunt beatae architecto velit. Id consequuntur magni minus eum nulla praesentium. Aut excepturi consectetur est et et voluptas.
3881, 389, Animi omnis occaecati qui officia necessitatibus qui. Quia pariatur quis quibusdam aut. Quod qui reiciendis molestiae vitae sit optio cumque dolor.
3882, 389, Sed occaecati iusto officiis. Placeat quos iusto qui dolor quod. Sed nemo eos qui et.
3883, 389, Quae error sed est omnis nam. Blanditiis sed libero incidunt possimus. Rerum earum et in tenetur similique.
3884, 389, Consequatur qui consequatur ex quas dolore ea soluta. Nulla sed similique nam occaecati ut qui. Quo necessitatibus ullam suscipit.
3885, 389, Accusantium ut veniam animi ipsum ipsa minima voluptate. Dolor quidem eveniet soluta nihil blanditiis nihil dicta. Quaerat fugit omnis aliquid optio ut.
3886, 389, Earum voluptatibus officiis eaque rerum incidunt. Accusamus cupiditate asperiores sunt impedit dolorum. Est aut accusamus eligendi ea.
3887, 389, Expedita at reprehenderit optio vel voluptatibus amet aut. Et aut aliquid sapiente. Nihil ut commodi quam neque omnis ratione possimus.
3888, 389, Impedit explicabo temporibus aliquid. Qui deleniti est rerum deserunt harum quos praesentium. Doloribus voluptas sint quas temporibus illum.
3889, 389, Animi assumenda quaerat dolore animi. Odio aut vero vitae. Dolor quo consequuntur ullam consequuntur provident.
3890, 389, Non molestiae quo et pariatur illum mollitia at. Sunt debitis vitae saepe ut modi. Enim qui voluptatem suscipit officiis aut omnis.
3891, 390, Magni amet quod voluptates quia. Laudantium qui sed quas. Iste voluptas rerum quibusdam.
3892, 390, Quo reprehenderit natus repellat facere eveniet explicabo eius eum. Nulla sed autem minus aut. Aperiam nihil sit porro inventore ut rem.
3893, 390, Et iste totam suscipit unde. Suscipit quis vel error ab qui dicta vel perspiciatis. Et dicta omnis sit eius.
3894, 390, Ut saepe explicabo labore veritatis et molestiae qui. Modi laboriosam qui doloribus harum voluptatem. Magni id sapiente quas excepturi eligendi aspernatur officia.
3895, 390, Et qui assumenda enim. Perspiciatis sed enim tenetur beatae laborum et. Exercitationem excepturi voluptatem quaerat.
3896, 390, Consequatur sed necessitatibus a occaecati aliquid quia sint et. Quos vel eveniet ad quo quos sint ex. Officia assumenda qui id.
3897, 390, Adipisci aperiam earum minima et non. Soluta ex velit deserunt laudantium exercitationem. Quis omnis et aut.
3898, 390, Esse aut maxime culpa in ea ex quis. Et nihil assumenda dolor qui quasi ut. Mollitia velit cum unde quia tempora tempore facilis ex.
3899, 390, Consectetur voluptate repudiandae praesentium ea eligendi minima aperiam perspiciatis. Fugiat fugiat magnam voluptates veritatis. Facilis in mollitia ducimus.
3900, 390, Enim illo ex dolor veritatis. Quo iure ullam nihil qui quis quia blanditiis. Cupiditate facilis omnis velit voluptates.
3901, 391, Excepturi omnis ea aut voluptas sit quia ipsa odio. Voluptatum qui blanditiis nesciunt quam libero. Ut sequi tempore cupiditate harum.
3902, 391, Quidem nihil facilis aperiam sed doloremque labore voluptate. Beatae at error expedita at. Quisquam qui in molestiae qui qui.
3903, 391, Et hic sed ullam ut in ex. Et sit aspernatur nam itaque architecto ut. Et aut magni voluptatem quibusdam est ullam dolorem.
3904, 391, Rerum et et a dolorum. Dignissimos ut dolores consequatur. Voluptate qui autem quia assumenda optio aut voluptatem ipsam.
3905, 391, Dolorem dicta vel aut aspernatur quis quia sunt. Veniam et est eligendi placeat deserunt sint facilis. Placeat harum autem ducimus.
3906, 391, Cum nihil ipsum facilis placeat quaerat molestiae. Alias unde quidem consequatur ullam quia maiores corporis ea. Aspernatur libero reiciendis veritatis.
3907, 391, Accusantium sint reiciendis non soluta. Quam dicta dolorum reiciendis consequatur. Velit alias iure voluptatem.
3908, 391, Quam aspernatur vitae sequi ea. Dolor mollitia sit quos voluptatem quae earum qui aut. Error officia non tempora delectus voluptatem quia sint veniam.
3909, 391, Veritatis necessitatibus doloremque quam vel dolor. Ea voluptas possimus eum repellat odit eum id. Optio sint ipsum et expedita.
3910, 391, Omnis debitis adipisci quia possimus aut. Quia nihil molestiae in assumenda. Vero voluptatibus aut nihil qui voluptates rerum eaque.
3911, 392, Vero tempora qui recusandae dolor. Qui voluptatem distinctio excepturi perferendis voluptatem mollitia. Doloribus est illum non quidem magni voluptate nostrum.
3912, 392, Est aut sunt aut. Non aut assumenda debitis ea sit. Occaecati beatae nulla non qui consequatur repellendus.
3913, 392, Dolorum incidunt qui qui impedit ea necessitatibus. Ut reiciendis ut ipsa quis soluta beatae. Aut reiciendis ducimus nisi doloribus voluptatibus quae quam.
3914, 392, Aut quasi non nulla at laborum. Ab ex harum aut. Nisi ullam dolores et.
3915, 392, Id autem magnam natus at voluptate voluptates incidunt. Esse sed esse minima sed molestiae. Sapiente voluptatem aspernatur dolor esse ea aspernatur.
3916, 392, Ut labore pariatur doloremque sequi praesentium laborum eligendi. Mollitia error est cumque consequatur maxime qui. Error dicta ducimus magnam odio non ipsum.
3917, 392, Delectus recusandae ut molestiae et est. Assumenda voluptas ut adipisci expedita eum ad vel aut. Quis nostrum perspiciatis quis veniam autem voluptatibus.
3918, 392, Sint quia vel similique. Reprehenderit in consequuntur architecto consequatur eos ut. Qui recusandae ut sunt placeat quas.
